context,date_time
绿色食品再开始,06-06 11:28
又要去3000点了，下一场保卫战又近在咫尺了。,06-06 11:27
每天只要石油一拉，其他全部暴跌,06-06 11:27
年前抄底了，现在不动,06-06 11:27
小心，证券又再补第二刀,06-06 11:27
4600多家下跌,06-06 11:27
又是一天冲高回落！下午继续！,06-06 11:27
上辈子做了什么孽，让我这辈子来炒股,06-06 11:27
看大盘这尿性，，好像大阴线又快来了。。。,06-06 11:27
开盘骗追涨的，盘中骗抄底的，一韭两,06-06 11:27
销户此生不再入大A,06-06 11:26
奇怪指标？指数跌3点，个股跌1900涨300?,06-06 11:26
内资中信天天跑，资金天天流出，今天[下跌][下跌][下跌][韭菜][韭菜][韭菜,06-06 09:57
光伏龙头砸盘？好样的,06-06 11:26
给散户一条活路吧！坚持不住了,06-06 11:26
停止量化交易！停止融券！#专家建议暂停量化交易！股友们怎么看？#,06-06 11:26
拉一下再砸我的票直接崩了牛,06-06 11:26
量化在，A股很难起来#专家建议暂停量化交易！股友们怎么看？#,06-06 11:26
很多股其实到年初2月份2700点的价格了，破不破3000点意义不大了。,06-06 11:26
每天跌4000多只股，跌着跌着就没有股了[面],06-06 11:26
又套一批人！高开就套！坑坑洼洼的！,06-06 10:09
微跌而已,06-06 11:26
量化真可恶严重影响股市价值投资！#专家建议暂停量化交易！股友们怎么看？#,06-06 11:26
破三千没有悬念了,06-06 11:26
能不能直接跌停？,06-06 11:26
还有谁不服,06-06 11:26
量化交易必须停止！每天都在扰乱市场！#专家建议暂停量化交易！股友们怎么看？#,06-06 11:26
稳指数已经没有意义，都是不计成本的出逃！！,06-06 09:57
公司涉嫌造假应该罚控股股东 而不是简单退市了之,06-06 11:12
反正我是不吃这个饼了，空起#专家建议暂停量化交易！股友们怎么看？#,06-06 11:12
下午跳水,06-06 11:12
小心，下午还得跌,06-06 11:12
指数红，股价全绿今年风格,06-06 11:12
早盘，5家被问函指数再次逼近3000点，晚间美股那边跳空大涨，英伟达，台积电等半,06-06 09:05
软件和计算机设备跌的厉害了，今天加点[摊手][摊手][摊手],06-06 11:11
从不买亏损票，结果六年来亏了近七成，太窝心窝囊了！,06-06 11:11
个股跌成狗。你居然红了,06-06 11:11
指数太假了吧4千多跌还红,06-06 11:11
[哭]账户每天都是亏的，绝望,06-06 09:54
不要在乱拉银行股了，有这资金把券商龙头两三只拉涨停点火，人气直接起来，四两拔千斤,06-03 10:16
遇到St就象生活中遇止老赖,06-06 11:10
高开低走#欧美股市大涨，A股今天怎么走？#,06-06 11:10
今天再绿就有点说不过去了[大笑],06-06 09:37
指数红彤彤，账户绿油油,06-06 11:10
你敢信嘛？这是我大A,06-06 11:10
技术型牛市,06-06 11:10
跌跌不休,06-06 10:31
今天的量起来了,06-06 11:10
量化害群之类,06-06 11:10
每天4000多家下跌，黄线跌幅2个点，这个市场与其他市场形成鲜明对比。,06-06 11:10
gif有能力让指数涨到一万点，但是你还是巨亏,06-06 11:10
我要，这指数有何用？,06-06 11:10
关注消费电子,06-01 03:28
这周减的还剩一成仓,06-06 11:09
为啥大盘还是红的？,06-06 11:09
北上死撑，亏不死你[大笑][大笑],06-06 11:09
这行情拜量化,06-06 11:09
又是指数拉，个股跌,06-06 11:09
4500家跌成这样，呵呵,06-06 11:09
回抽年线确认跌破，下一步回踩半年线,06-06 11:09
3062是牛熊分界线。有效跌破风险是B浪。B浪可以创新低，但市场不允许了。,06-06 10:34
大盘是红的，真是奇迹,06-06 11:09
4500支下跌，指数红了，不拿散户当人了,06-06 11:08
大盘涨了牛市[赞][赞][赞],06-06 11:08
4500绿大盘居然 红了， 你说搞笑不搞笑,06-06 11:08
个股2500点,06-06 11:08
看到指数是红的好奇怪，但是我默默希望你再红一点。,06-06 11:08
牛啊,06-06 10:08
4500家下跌,06-06 11:07
远离股市，珍爱辛苦钱#专家建议暂停量化交易！股友们怎么看？#,06-06 11:07
指数是怎么红的？,06-06 11:07
个股一直跌，指数怎么不跌？怎么可以这么假？,06-06 11:07
王鳖勾庄,06-06 11:07
4000多家下跌，三指全红？？,06-06 11:07
盘点 | 中远海控突遭外资抛售,06-05 07:03
市场的指数是假的吧！个股跌成狗了，它还能红,06-06 11:07
韭菜啊太惨了。,06-06 10:05
板子可以打在量化上，实质是急功近利、伪融资认知导致…投资、是一个持恒的行为，上市,06-06 11:07
如果一个市场的指数微跌，而绝大多数个股跌成翔，这就是一个社会的普遍特征与缩影，九,06-06 10:32
我劝天空重抖搂,06-01 10:55
指数又回来了，账户余额却少了,06-06 11:06
拉升时放的量低于下跌时放的量，就为了拉红指数拉个别权重。,06-06 11:06
下午2900,06-06 11:06
指数好牛皮,06-06 11:06
各种什么产业政策，反应到股市，跟放p一样，利好砸，利空砸，利好就利好出尽，利空更,06-06 09:53
中石油工业富联等六家股票就涨了11个点指数看着是上涨的但大多数股票在不断的走向低,06-06 11:06
涨指数不涨个股，明天又是四千多家下跌,06-06 11:06
好不容易上了年线又掉下来了,06-06 11:06
一个星期亏了3成,06-06 11:06
这是什么行情,06-06 09:50
现在才知道存银行的好，天天跌3%，谁受的了，每次都是大批人割肉后再反弹，屡试不爽,06-06 10:30
每天4千+待涨[哭],06-06 11:06
怎么有个红！,06-06 11:05
为什么为什么为什么不停量化阿！，！！！！#专家建议暂停量化交易！股友们怎么看？#,06-06 11:05
恭喜纳斯达克etf又历史新高,06-06 11:05
#专家建议暂停量化交易！股友们怎么看？#已一键割肉清仓，逃离股市！,06-06 11:05
今天指数收盘要是红了，你猜会不会上热搜？,06-06 11:05
不让散户玩了吗？？,06-06 11:05
低空经济主力做空,06-06 11:05
大盘股拉着，小盘股狂跌6666！,06-06 11:04
每天都是10分冲高，下跌3小时,06-06 11:04
大A奇迹，指数工程，你见过4300家跌的股市（700多红的），指数还是红的吗[捂,06-06 11:04
指数红了，股票还是4000多家绿,06-06 11:04
红了红了,06-06 11:04
4个字形容，惨不忍睹，，，，,06-06 11:04
又给小散发了个套。[大笑][大笑][大笑][大笑][大笑][大笑],06-06 11:04
"新“国九条""推进下，这些资产的牛市已来！！",06-05 02:37
不炒股才是王道，玩不过他们的,06-06 11:04
黄金周度观察：2024年第23周,06-06 10:58
天天一样的套路就有人天天上当，怎么？都想着自己是那万中无一的天才吗？什么时候成交,06-06 10:58
不到20%的票拉红指数，大A牛,06-06 10:58
量化是投资吗#专家建议暂停量化交易！股友们怎么看？#,06-06 10:57
扰乱市场#专家建议暂停量化交易！股友们怎么看？#,06-06 10:57
紫金天风：黄金周报：通胀放缓又如何？,06-06 10:57
这字数还红的，个股跌的家都找不着，真黑,06-06 10:57
可能真的是在涨吧,06-06 10:57
给你们看看现在10点后融券放开的威力！,06-06 10:18
外面红旗飘飘，又是高开低走,06-06 10:19
今天又来个高开跳水，还有600只上涨又是牛市的一天！哈哈哈哈,06-06 10:12
怎么做到的指数红，跌4400+家，真有意思,06-06 10:57
可以T+3，如果是T+0就是作弊#专家建议暂停量化交易！股友们怎么看？#,06-06 10:57
好玩,06-06 10:57
服了服了，指数涨，股价跌,06-06 10:57
开始了开始了，跟随美股往上走。欧耶,06-06 09:37
大盘红的，但是还有四千多家下跌[捂脸],06-06 10:57
量化等于开卷和作弊#专家建议暂停量化交易！股友们怎么看？#,06-06 10:56
小盘股又是大！唉！,06-06 10:56
指数回来了，钱却不见了[吐血],06-06 10:56
全体韭菜做好准备,06-06 10:56
东财还是有很多牛人的嘛,06-06 10:56
应该收拾宁聚量化交易了,06-06 10:56
想知道怎么买米股呢？,06-06 09:53
高潮是不是结束了？,06-06 10:56
又拉的大权重。,06-06 10:55
转融通才是最大的不公平。其他都是小事。#专家建议暂停量化交易！股友们怎么看？#,06-06 10:55
大盘萎靡了好几天了，大盘调整了有好几天了。昨晚$锦龙股份(000712)迎来的一,06-06 09:55
钱输了空仓了也算是一种 解脱,06-06 10:55
大盘是红的，我的票跌了8个点，怎么做到的呢,06-06 10:55
史一样的行情！,06-06 10:55
大盘天了。3050没碰到。,06-06 10:55
越不让量化，越量化给你看[呲牙],06-06 10:55
大盘红着的，还亏着10万，还得是在这里投资[笑哭],06-06 10:55
上午全是红盘，下午全绿，,06-06 09:36
能不能让韭菜们回回血,06-06 10:55
指数怎么红的啊，你怎么好意思红的啊,06-06 10:54
涨起来了，,06-06 10:54
量化是高能收割机#专家建议暂停量化交易！股友们怎么看？#,06-06 10:54
#专家建议暂停量化交易！股友们怎么看？#量化依据本地股市的历史交易数据操作，并加,06-06 10:54
只拉超大盘股各位嘎的更快,06-06 10:54
这大盘走势有没有可能红色票都给你干绿,06-06 10:54
离开吧,06-06 10:54
我还有2%的资金，准备杀进去,06-06 10:54
既然微盘股都要退市，为何还要上市,06-06 10:54
牛逼大盘还红了,06-06 10:54
黄线惨不忍睹，1亿13亿的较量。,06-06 10:54
拉指数有毛用,06-06 10:54
大盘涨，我又亏5个点，真牛逼,06-06 10:53
又有多少人刚刚被骗进去了[捂脸],06-06 10:53
一拉一咂指数没变，钱没了[捂脸],06-06 10:53
指数应该跌两个点，才对的上亏损啊,06-06 10:53
真神奇，大盘是红的！！！,06-06 10:53
你把沪深300拉天上去，老子也不会去接你的盘,06-06 10:53
哟，今天这是要放量,06-06 10:53
干拉,06-06 10:53
我赌大盘今天能红到9:59。,06-06 09:20
绝对的害人#专家建议暂停量化交易！股友们怎么看？#,06-06 10:53
这个情绪偏多是认真的吗,06-06 10:53
看到没有，为何周一大跌7个点，不是无缘无故的。一天赚七个点，上哪里去找这么好的事,06-06 06:52
券商调整到位，指数无忧,06-06 10:53
利空A股#欧美股市大涨，A股今天怎么走？#,06-06 10:52
指数震荡我的钱没了,06-06 10:52
冲击3097不是问题,06-06 10:52
拉这个有啥用，个股跌成狗了,06-06 10:52
赶紧收盘吧，大盘涨个股跌，大盘跌，个股暴跌，甄妮吗,06-06 10:52
开盘才一个小时朱丽就流出150亿？,06-06 10:52
红了红了，反弹来了！,06-06 10:52
量化控制了一切,06-06 10:52
现在是看指数涨，账户里得钱每天都有减少，,06-06 10:52
弱势下跌趋势改不了,06-06 10:52
大盘已经到了2650点了，,06-06 10:52
放量拉起来了，又是权重起来了吧,06-06 10:52
指数，个股落花流水,06-06 10:52
每天看手机没有一个红的,06-06 10:51
小票就该死吗？,06-06 10:51
请问拉了啥,06-06 10:51
今天这坑挖的太深了，得要多长时间才能修复啊？,06-06 10:51
量化一停，交易量暴跌，估计不会停，量化停了，交易数据太难了#专家建议暂停量化交易,06-06 10:02
连续几周这个行情，这周更是直线下降，诸君，真的都赚到钱了嘛,06-06 10:51
指数回来了，我的钱呢[捂脸],06-06 10:51
直线拉红，大家一点赚疯了吧,06-06 10:50
类似量化的这种弊端品种繁多#专家建议暂停量化交易！股友们怎么看？#,06-06 10:50
生产队的驴也没这么歇的啊，起来干活了主力,06-06 10:50
天天拉中石油护盘。。。。也有不灵的时候,06-06 10:16
666#专家建议暂停量化交易！股友们怎么看？#,06-06 10:50
指数回来了，个股呢，依然深跌，哈哈哈,06-06 10:50
上涨家数还是少了点，共振比较难,06-06 10:50
明天节前效应，将迎来断崖暴跌[偷笑][偷笑],06-05 07:50
今年做空能发财,06-06 10:50
感觉又是，个股惨不忍睹,06-06 10:49
真好，大盘天天红，个股大跌。,06-06 10:49
一块山芋地，有用推土机，有人用镐刨，推土机不够油费，用镐的不够功夫钱。#专家建议,06-06 10:49
加油大A，10日后又专题大会,06-06 10:49
量化交易把投资当成了游戏，扰乱市场。#专家建议暂停量化交易！股友们怎么看？#,06-06 10:49
黄金的大趋势是多，我们只宜逢低做多,06-06 06:55
一点也不避讳啊，马上就是5000多家都是跌的了，指数既然敢红[捂脸]，我真怕它自,06-06 10:49
为什么主力资金天天流出？既然是公布的数据指标，应该是能准确反映市场交易情况的指标,06-06 10:49
围绕年线反复整理并予以支持[加油]横有多长这一块的,06-06 10:49
搞得人心㤺㤺,06-06 10:49
今天这盘面还要打压说不过去了,06-06 10:49
每一次下跌跟我有关系，每一次下跌再拉升跟我都没半毛钱关系。,06-06 10:49
【工业富联，拉升半导体消费电子，带动整个A股反弹】,06-06 10:49
希望在哪里,06-06 10:02
电力护盘失败,06-06 10:49
同意专家建议,06-06 10:49
清仓了，受不了。,06-06 10:49
A50大涨了！,06-06 10:48
空拉指数没用，小散不会上当[憨笑][憨笑][憨笑],06-06 10:48
北上使劲拉啊，挺住啊[大笑][大笑],06-06 10:48
科创板成鸡肋，A股涨幅前50仅1家,06-06 10:18
逢买必跌#专家建议暂停量化交易！股友们怎么看？#,06-06 10:48
今天有万亿的一成交额了！[强壮][强壮][强壮],06-06 10:48
好了好了，收盘吧。。。。怕下午又跌回去[亏大了],06-06 10:48
你们有钱，你们拉，我看着，不买真好[大笑][大笑],06-06 10:48
天下奇观，指数红的，4300多家绿的,06-06 10:48
麻了,06-05 03:32
你天天红，我天天赔钱，[旺柴][旺柴][笑哭][笑哭][哭][哭],06-06 10:48
北向资金的动态也只有一少部分人可以看到了,06-06 10:48
就这不到一个办小时，开盘赚1万多，然后亏1万多，现在又翻红……情绪有点受不了了,06-06 10:48
别抄底,06-06 10:48
上午拉高出货，下午套人，有意思吗？,06-06 10:47
#专家建议暂停量化交易！股友们怎么看？#取消量化取消转融通,06-06 10:47
不去五日线，分明又是耍流氓,06-06 10:47
不玩了,06-06 10:47
指数红了，个股绿油油，呵呵服气吗？,06-06 10:47
跌的湿滑柔顺,06-06 10:05
指数回来了，小盘股跌惨了，去散化太厉害了,06-06 10:47
周三三大指数震荡收跌，沪指领跌，两市成交额不足7000亿，两市超4600只个股飘,06-06 10:16
有多少股民比大盘2650时亏的多！,06-06 10:47
又开始老乡别走节奏了[大笑][大笑],06-06 10:47
我想问句，为啥指数红了，我得都是跌。。。,06-06 10:47
又是这个路子吗，上午先跌后仰，下午再跌回去，第二天直接低开低走,06-06 10:47
去散户化，去散户化,06-06 10:47
拉得是指数,06-06 10:47
牛市来了，只有4400多只股票待涨，大盘竟然神奇的红了,06-06 10:47
4000多只票下跌，大盘居然涨了那么多[怒],06-06 10:47
北向在买。,06-06 10:46
网评跌破3050不可能，都买就对的,06-06 10:46
要骂人了,06-06 10:46
个股都是跌的，指数是怎么做到大涨那么多？？,06-06 10:46
硬是把指数拉红了，哈哈哈,06-06 10:46
我有一个大计划！要不要干！,06-05 10:54
不懂就问，刚刚截了个图，不知道这是什么原理？,06-06 10:46
3048点博反弹，重点游戏股，华为鸿蒙板块,06-06 10:13
谁还来投股#专家建议暂停量化交易！股友们怎么看？#,06-06 10:46
竟然还有4000多支下跌,06-06 10:46
大A强势回头，指数又又又又又红了,06-06 10:46
如果全球开启降息周期，那会发生什么？,06-06 10:46
李大小回来了，快快快,06-06 10:46
不把散户扒了一层皮就不拉,06-06 10:46
大盘涨汇成真，今天应该要掉过23％，明天再掉个10％,06-06 10:46
大盘翻红，还有4600只股票下跌。叫小散咋玩！,06-06 10:46
量化空翻多的一个典范，上车回血了，开始慢慢长牛的行情,06-06 10:46
全红，4千只股票下跌，骗人也不能这样骗散户,06-06 10:45
牛回速归,06-06 10:45
散了吧，有行情再见。,06-05 04:54
又要磨吼2个月了,06-06 10:45
神经吧，要跌一起跌啊，搞得都不敢进[囧],06-06 10:45
大盘指数全部红盘，,06-06 10:45
这次指数股选对了，几千支股下跌，大盘指数还能有不错的上涨[大笑],06-06 10:45
为什么市场多次跌这么惨？,06-06 10:45
每天跌4000多家，大盘是怎么红的[大笑],06-06 10:45
牛逼，我不敢相信自己得眼睛,06-06 10:44
又废了空拉指数，指数涨了30点4000多家下跌,06-06 10:44
取消量化，全民共识#专家建议暂停量化交易！股友们怎么看？#,06-06 10:44
指数回来了，我的钱没了,06-06 10:44
指数上去了，个股不能看,06-06 10:44
4320家跌，仅900家涨，你是怎么红了0.3％的,06-06 10:44
拿了一周，卖飞了，买了其他股还被套了，悲伤,06-06 10:44
打假要稳准狠，但假打要严惩！！！恶意把公司账务做虚亏收集筹码等来年改头换面再上市,06-06 10:44
满仓创业板了,06-06 10:44
今日恐贪指标7。,06-05 09:55
4300家下跌，指数还大红，,06-06 10:44
[旺柴]年前的味道又回来啦，都回来啦,06-06 10:44
不可思议既然是红的！,06-06 10:44
又开始假拉了，管住手,06-06 10:44
1000家不到上涨，指数红0.3%[奸笑],06-06 10:44
什么是真科技，什么是假科技，一目了然，英伟达才是真科技！CPU攻克多年，得到的结,06-05 10:45
六绝太牛了,06-06 10:44
上市随意，退市随意。,06-06 10:44
国九一出，俺就跑到大蓝筹避险了，很安全，还赚点[呲牙],06-06 10:43
反复诱多别上当,06-06 10:43
四千多家下跌还红盘,06-06 10:43
5000多只股票，20%上涨都没有，估计每天亏钱的不等于80%的投资人吧，股票投,06-06 10:43
指数自己又回来了，个股一动不动,06-06 10:43
$上证指数(SH000001)$,06-06 10:43
3053破了就嘎还好没破,06-06 10:43
这样也能红,06-06 10:43
指数牛,06-06 10:43
指数翻红了，4000多只股票待涨，加油！,06-06 10:43
市场不好就应该用非常办法，一年内只允许买不允许卖。#专家建议暂停量化交易！股友们,06-06 10:42
量化背了好大的锅，感觉美股纳斯达克别人没有量化一样。#专家建议暂停量化交易！股友,06-06 10:42
看看两条线有多远吧，大盘下跌，全部票票跟着跌，业绩不好你可以不张，业绩好的你为什,06-06 10:42
4500家下跌，指数是红的，哈哈哈哈哈,06-06 10:42
$南京新百(SH600682)$昨天中信说利好，今天就大阴跌，中信说南京新百8元，可是中信在6-7元之间出货几个亿，我想不明,06-06 10:42
谁搅局，就应该让谁出局！非常时期，非常手段！,06-06 10:42
全部清仓了，一早上又亏了8000多，扛不住了，没底线的下跌，指数却还能保持红盘。,06-06 10:42
不涨，没有成交量，,06-06 10:42
近4000家下跌，大盘仍红,06-06 10:42
想跑，就得割肉。断臂长能求生。是勇士还是懦夫？一月我割肉了。四月底我清仓了。年底,06-06 10:42
大盘全红，4400家下跌，看不懂啊看不懂,06-06 10:41
800家上涨，指数是红的！哈哈哈哈哈,06-06 10:41
奇迹,06-06 10:41
红盘，个股都飞流直下3000了[哭],06-06 10:41
反弹一点量能都没有，跌的时候都是放量，反抽逃命吧,06-06 10:41
大A也别喊3000点保卫战了，每次突破3000，在上方运行时，就应该逢高减仓，那,06-06 10:41
当前大票以不受待见,06-06 10:40
4300家下跌，指数红的,06-06 10:40
个股跌成狗了,06-06 10:40
拉到3100，把做空的活埋了。,06-06 10:40
大盘3050点是调整极限，加仓的好时点,06-06 10:40
量化应该禁止#专家建议暂停量化交易！股友们怎么看？#,06-06 10:40
神奇的大A，这就红了[憨笑],06-06 10:40
万亿资产盈亏无责稳赚,06-06 10:40
牛市从今天开启。2024.6.6,06-06 10:40
可以买了，反转了,06-06 10:40
4千多股下跌股指还红了牛逼,06-06 10:40
大盘都红了，你们挣钱了吗？,06-06 10:40
MD看看黄线,06-06 09:51
指数都是红的，你们在哪里骂骂咧咧，真是一点格局都没有,06-06 10:40
个股跌的不行，指数却拉红了,06-06 10:40
不知道大盘为什么红,06-06 10:40
4000多股绿盘，大盘还可以红,06-06 10:39
涨了涨了红了,06-06 10:39
好险，差点就破3000了,06-06 10:39
4500+下跌，指数是红的,06-06 10:39
现在股市不断让人长见识！,06-06 10:39
今天大盘涨停,06-06 10:39
又红了[大笑][大笑][大笑],06-06 10:39
老乡红了，快来玩啊,06-06 10:39
量化只是对小部分人和机构有利，散户就是九菜。#专家建议暂停量化交易！股友们怎么看,06-06 10:39
奇葩，四千五百多加下跌指数还能红,06-06 10:39
下周3033,06-06 10:39
只看锅队了,06-06 10:39
抄底一部分仓位。成功做T,06-06 10:39
再套一波[笑哭][笑哭][笑哭],06-06 10:39
有大行情，快来，下套，完美收割。,06-06 10:39
现在就是指数行情了，基金开始赚钱了。,06-06 10:38
有大行情，快来，下套，完美收割。,06-06 10:39
现在就是指数行情了，基金开始赚钱了。,06-06 10:38
下午收盘拉轰，标题三大股指强势翻红，连阳护股民快乐过节,06-06 10:38
尽快退市不分红的股票，亏损的股票，退到一半股票才有机会走好#专家建议暂停量化交易,06-06 10:38
山东章鼓来个大哥抄底啊,06-06 10:38
基金全绿，这个操盘手牛逼,06-06 09:57
是的，量化就是短线思维，割韮菜庄家，应暂停量化交易#专家建议暂停量化交易！股友们,06-06 10:38
一拉一砸，个股更惨，比春节前后亏得更惨，指数居然涨了3百多点,06-06 10:38
炒股一定要改变一个思维模式，就是靠股票上涨赚钱！,06-06 10:38
又是四千家下跌，行业板块，概念板块红的都是个位数，这指数怎么回事？,06-06 10:38
什么情况？板块基本持平，但是个股接近4500个下跌？,06-06 10:38
把小盘股跌成微盘股，把微盘股跌成退市股,06-06 10:38
小票不启动，拉什么都没用,06-06 10:38
#专家建议暂停量化交易！股友们怎么看？#量化不停，散户遭殃！,06-06 10:38
指数回调100点左右，很多个股又创春节前新低了,06-06 10:38
北向开始发力了,06-06 10:38
哈哈，看看人家是什么样的公司再涨，再看看自己是什么在涨，哈哈,06-06 10:38
这玩什么，每天4000多家下跌,06-06 10:38
上证指数盘中跌破年线，目前主力资金流出180亿多，这次是否还能收到年线上方？,06-05 02:24
大盘很强,06-06 10:37
大盘3053，个股现在已经比当时2600时候估计还低了，快要疯了,06-06 10:37
今年跌20个点以上就有1900家[吃瓜],06-06 10:37
放量了，这种放量，明显跑路了,06-06 10:37
大盘红了，股票绿了4个多点[捂脸][捂脸][捂脸][捂脸],06-06 10:37
两次背离了，不涨有天理吗,06-06 10:37
炒股十年的我已悲观到极致！半仓都能亏成这样！清仓灰灰溜溜的走了！,06-06 10:37
没事才跌0.1，也不过是4600家绿,06-06 10:37
开盘就是啊,06-06 10:37
不行从今天开始提前把端午节假期过了吧[捂脸],06-06 10:37
黄线都破2900了，白线还在拉拉扯扯，真他娘恶心,06-06 10:37
量化跟开挂有什么区别！#专家建议暂停量化交易！股友们怎么看？#,06-06 09:45
指数在上涨,06-06 10:36
真牛逼，指数没跌，个股，兄弟们,06-06 10:36
为什么受伤的总是我,06-06 10:36
说过了#专家建议暂停量化交易！股友们怎么看？#,06-06 10:36
在当下，任何时候销户都是明举。,06-06 10:36
静待上证跌破3000点的机会,06-06 10:36
故意打压小盘股，想让小散去大盘股接盘，做梦，劳资死扛，有种小盘股全部st,06-06 10:36
支持暂停量化交易#专家建议暂停量化交易！股友们怎么看？#,06-06 10:36
真实的大盘早在2500了,06-06 10:36
今天割肉的很多，要反弹了,06-06 10:35
开盘没了500，真吉尔,06-06 10:35
跌到2635做个双底，然后一路冲到3700,06-06 10:35
大长腿随时开跑,06-06 10:35
不能看指数，指数跌了一点4000多家待涨。不能买记住峰高减仓不会错。,06-06 10:35
两桶油又在护指数,06-06 10:35
A股走势十分反常，恐怕有大事要发生了，马上告诉所有人,06-05 08:50
一首凉凉送给大家吧,06-06 10:35
黑夜给了我黑色的眼睛，我来用它去寻找光明。而你却红了双眼，拼命的在深渊里挣扎……,06-06 10:35
量化问题都不是问题了，现在的问题是散户躺平，机构跑路。流动性没了，资金也没了[滴,06-06 10:35
机会是涨出来的，越跌越没希望，可惜A股都是反向认知，那就跌吧，跌回3000点以下,06-06 10:35
量价背离,06-06 10:35
韭菜割掉，根挖了，渣也不留，太狠了，没有保护长期资金谁敢来,06-06 10:35
3050满仓找股抄底啊,06-06 10:35
中小盘天天开盘拉半小时，出货到收盘,06-06 10:35
又是电力蓝筹。。。[吃瓜][主力],06-06 10:35
指数不对啊，大部分个股已经跌回2600点时的位置。,06-06 10:35
又该保卫3000点了[捂脸][大哭],06-06 10:35
就因为昨天有机构唱多了吗,06-06 10:35
去量化#专家建议暂停量化交易！股友们怎么看？#,06-06 10:35
大盘跌破位，相关单位强制支撑大盘，大盘不补跌，根本不会有好的起色，因为资本需要大,06-06 10:35
