context,date_time
今天2900保卫战，明天2800保卫战，后天2600保卫战,06-24 11:04
妈的，抄底又被套了[大笑],06-24 11:04
这回估计又要有一部分人要清仓销户了,06-24 11:04
等放量千万别急！,06-24 11:04
好#IPO受理、上会全部恢复，如何解读？#,06-24 11:04
又要见到2600吗,06-24 11:04
以后机构和主力只能做多，散户可以做空，估计就天天涨了,06-24 11:04
这行情，就问你服不服？,06-24 11:04
下午直接击穿2900,06-24 11:03
都没拉完，就跌了一个点,06-24 11:03
抛压太大，对手盘是谁？,06-24 11:03
抓紧发布禁止做空令！,06-24 11:03
还有的熬，慢慢熬[摊手],06-24 11:03
这波调整大概率会破2600，观望微商。,06-24 11:03
这波我看到2700,06-24 11:03
五千只股票待涨。。。。,06-24 11:03
清仓了！明天销户去,06-24 10:01
感觉大盘要加速下跌了啊，认亏清仓,06-24 11:03
劳资就拿几千块陪你玩，超一万都对不起自己！！！,06-24 11:03
所有人都等信号，一起反攻，结果就这么玩不愧是我大a,06-24 11:03
好嗨哟,06-24 11:03
2905止跌，现在别买,06-24 11:03
老铁们准备好了吗，下个礼拜破2900[大笑],06-23 09:59
指数低开下杀带量，不过这位置前期的密集成交区，市场恐慌情绪蔓延早上恐慌盘也割的差,06-24 11:03
