context,date_time
大家大胆买入，下午反包收大阳板上钉钉！,05-28 11:29
没有溢价全是套人你让大家怎么玩？钱又不是大风刮来的[怒],05-28 11:16
这指数看得难受,05-28 11:29
到点了吃饭了,05-28 11:29
3400家绿的，大盘居然是红的,05-28 11:16
每天打开股票，除了指数都是绿的！,05-28 11:28
我有一个朋友今年炒股赚了68万我问他怎么赚的，教教我，他说给别人推荐股票，那个人,05-28 11:03
请问买股票被套牢可以理赔吗？,05-28 11:16
上证指数不涨不跌，个股都在2600为什么？,05-28 11:27
指数3100点，我的股票在2600点,05-28 11:27
昨天分红了，挺高兴，今天看怎么还亏了呢，完事还缴税吗？亏了怎么还要缴税？分红到哪,05-28 11:11
没人玩了,05-28 11:27
刚刚一会功夫，明明反弹的保险和证劵板块都跌绿了，地产这个高开低走更有意思，套了一,05-28 11:26
我的股市，你怎么只剩下下跌一条路？,05-28 11:26
能连续放量2-3天维持万亿在来玩吧，不然时间，越卖越亏，本来这个月不亏，,05-28 11:25
金石恒久远，民食为天地，科北有财富，建设能翻天。,05-28 11:25
没成交量全是一日游,05-28 11:09
30分钟反弹是不是结束了,05-28 11:24
多位2800见,05-28 11:24
钝刀子割肉太狠了,05-28 11:24
爆涨涨涨涨,05-28 11:24
A股：5月24日 周五 有望上涨板块及强势个股,05-23 10:39
又往下了，就这？[笑哭],05-28 11:23
大资金的天下，不停的套人,05-28 11:23
昨天下午进的全干里面了[大笑],05-28 11:23
雄起,05-28 11:23
可谓闻风色胆,05-28 11:23
昨天涨没咱的份，今天跌没有一片雪花是无辜的[好困惑],05-28 11:23
什么玩意,05-28 11:22
股指涨了。帐户资金还停留在2700点上。怎么回事？？？？？,05-28 11:22
开始砸盘了！,05-28 11:21
这一天天的，没一个赚的。基本上都是亏的,05-28 11:21
帅呆了，大家轮流涨，买就套[笑哭],05-28 11:21
割吧！割完了！哦，对了，现在不是割，是连根拔了,05-28 11:21
谁买谁亏，来一个收一个,05-28 11:21
两桶油   就是我们的全部,05-28 11:21
A股：5月27日 周一 这些个股有望继续上涨？,05-27 09:08
我的分红到哪里去了，,05-28 11:20
就是不关量化,05-28 11:20
又是亏钱卖买的一个星期,05-28 11:20
牛来了？,05-28 11:10
前几年基金经理兰兰、坤坤、蔡蔡也是这么说的，长期价值投资。。$上证指数(SH00,05-28 11:20
这次彻底销户了，不管什么行情都是天天亏。,05-28 11:09
空头市场提倡价值投资[大笑],05-28 11:20
发套行情！,05-28 11:19
原来昨天是挂挡加速下跌。挂进去了，挂挡。,05-28 11:19
今天还能亏钱也是没谁了吧，这是目前持仓，准备明天处理了，今天在外面没操作。这大盘,05-27 02:51
个股都要跌到2000点了,05-28 11:19
上午反抽诱多，下午飞流直下………,05-28 11:09
在震荡中，指数上去了，你的钱没了，存量博弈市场就是这样。,05-28 10:57
现在一天恨不得把板块轮动个变,05-28 11:17
我想问问，主力天天流出到底是什么情况？,05-28 11:01
做空和量化机制不控制，大盘向上走的空间不会很大。,05-28 11:16
大概率要再次诞生当年光大证券式直线n倍总龙头!,05-27 01:45
2680指日可待？都是量化交易惹的祸？！！！,05-28 11:15
赶紧封盘捂盘，打折统统收回，已卖出的合同作废，给业主赔点定金钱赶紧让他们走人。接,05-28 11:15
你们今天跑赢大盘了吗,05-28 11:07
市场如期反弹，三大指数全线收涨，反弹只是刚刚开始。,05-27 03:31
烂泥扶不上墙,05-28 11:14
存量资金博弈，谁追谁死，昨天追进去的全部死！电力板块急等出货，不接盘还是死。低位,05-28 11:14
没救啦，买股票第一天是想赚钱的，后面是想回本，,05-28 11:14
港股有苦说不出,05-28 11:14
3600+待涨，指数稳如泰山,05-28 11:13
请问销户是打客户电话吗,05-28 11:13
都在看3200，怎么我在看3000,05-28 11:04
今天成交额低于7000亿！,05-28 11:13
妈呀昨天涨1个多点我才赚几十块今天就这样我没了1000了快[韭菜][韭菜][韭菜,05-28 11:13
$上证指数(SH000001)$,05-28 11:03
今天最多7000亿,05-28 11:12
上午盘面解读,05-28 11:12
个股天天跌麻了。大盘稳住不动,05-28 11:12
还是要说一句，指数好看，个股是真拉稀，板块轮动太快！,05-28 11:12
昨天大涨账户回来四千零一点，今天小跌，账户绿五千多，了，有啥意思,05-28 11:12
半导体3440亿三期大资金都带不动不盘，还缩量，看样子3100还得多踩几次,05-28 11:11
不管大盘涨跌内资天天有股票卖出，这么大的量是从哪里得来的股票,05-28 11:03
日日月月年年内资都在不停的卖出，就这么不看好我们的股市吗？,05-28 10:52
亏起来太顺利了[大笑][大笑][大笑],05-28 11:09
主力天天跑这么多，四个月跑了2.17万亿,05-28 11:09
利好越出越跌咋回事？？？,05-28 11:01
这市场怎么啦,05-28 11:08
$上证指数(SH000001)$,05-28 11:08
没有资金捧场，难,05-28 11:08
大盘会涨吗？,05-28 12:05
建议禁止融券，要求机构董监高返还,05-28 11:07
内资没有哪一天不是跑的,05-28 11:07
这周又白玩了,05-28 11:07
$上证指数(SH000001)$,05-28 11:06
个股2500点,05-28 11:06
板块轮动，哪个板块散户割肉多哪个就涨，轮动完毕一齐跌,05-28 11:06
回顾历史，地产政策还有多少“期待”空间？ ,05-28 11:06
上午100亿，下午50亿，今天150亿，真有钱,05-28 11:06
完了完了，回本无望了，亏得越来越多了！,05-28 11:00
主力流出近60亿，仍然偏多，主力资金流出有向科技股流入趋势，规模不大，没有形成主,05-28 10:01
这是收割的节奏，昨天下午拉起，今天就这样！？方向应向上，坚持好的公司股价还得涨！,05-28 11:06
中特估是未来主线。推荐江苏银行，建设银行，上海银行承诺中期也分红，股息再复投享受,05-28 11:05
看到犯困,05-28 11:05
每天拉指数百分之七十却是绿的亏的鞋都提不住了,05-28 11:04
投机资金继续流出,05-28 11:04
2007开始到今天，亏损80本金，129进来，还有不到50[大哭][大哭][大哭,05-28 10:36
再一次沉寂，撤了,05-28 11:03
天天这样，玩什么,05-28 10:53
ai芯片才是重中之重，现在又让专家叫兽给带歪了，,05-28 11:03
开盘回11000，现在还剩1000，回本没指望了,05-28 11:02
大盘都3100了，比2600的时候亏的还要惨，什么原因呢,05-28 10:46
太难了,05-28 11:02
看来中字头也不好使了，拉不动了,05-28 11:02
快跑,05-28 11:02
千年的老熊,05-28 11:01
又是一日游吗,05-28 11:00
天天打雷，防不胜防！心在滴血,05-28 11:00
7000亿的成交量，里面得有5000亿是量化在这左右手。无聊的很啊。躺平任你跌,05-28 11:00
老乡别走，还有利好,05-28 11:00
这种行情令人作呕,05-28 11:00
这一天天的票价到了2300点了,05-28 10:59
又是悲惨的一天！,05-28 10:51
每次拉高都是清仓机会,05-28 10:59
看看月线图，等等再买！,05-28 10:58
结构性行情根本没用，红了指数绿了钱包,05-28 10:58
指数空涨，个股砸盘,05-28 10:58
每天拉石油股就能护住大盘，大家都去买吧,05-28 10:58
哈哈哈哈哈,05-28 10:57
关闭融券，取消量化,05-28 10:57
没什么意思，市场缺增量资金，拆东墙补西墙！,05-28 10:17
这种难受劲又回到年前2700的状态了，次次都上当，当当不一样,05-28 10:53
大盘要想走好，还得靠房地产啊！房产走强那几天，也是大盘最好的时候。,05-28 10:56
低空飞行调整好久了，会不会起飞呢？,05-28 10:42
加油！,05-28 10:56
请问怎么销户，不销有没麻烦,05-28 10:56
真牛指数红个股不断新底，高实在是高,05-28 10:56
没关系，能坚持两个小时已经很厉害了,05-28 10:56
昨天大涨我亏，今天小跌我大亏,05-28 10:55
不服不行,05-28 10:55
为什么天天这样？,05-28 10:55
中石油一会要是···············,05-28 10:55
这样下去，我都准备去太原桥,05-28 10:54
3200是顶,05-28 10:54
又被骗进来了咋办,05-28 10:54
这个大鸡金就是给内资接盘的，别给忽悠到，看看内资哪天是流入的，天天几百亿的跑，根,05-28 10:54
这几天买啥亏啥，清仓了，累了累了,05-28 10:54
为什么你可以那么废,05-28 10:53
最不能信的是股评的嘴巴！,05-28 10:53
又恢复了半死不活的样了,05-28 10:53
【盘面解析】早盘市场其实遭遇了一波兑现抛压的，特别是芯片一度是0涨停，不过紧跟着,05-28 10:53
有色股可出2/3。同时可关注化工股了（同时周期股[得意],05-28 10:53
哪来的那么多筹码砸盘？都在变相减持？还是大规模融券做空？,05-28 10:53
又是开拉大盘股，沪指红创业板指数绿，后面估计还是被拖下水,05-28 10:53
还不销户吗，钱多…………,05-28 10:53
大家都别玩了,05-28 10:52
冲不起来了,05-28 10:51
还不跑等啥了,05-28 10:51
来个下杀。#大利好！“史上最严减持新规”升级落地##沪指收复3100点，A股重拾,05-28 10:51
拉了540点还不过瘾，这么高位，散户都不愿意买了。存量资金跑了不少，成交量越来越,05-28 10:50
半导体下一个是谁,05-28 10:45
开双向交易吧，这个量能，收割盘，真让人无奈,05-28 10:45
卖股票不如卖公司挣钱来得快,05-28 10:50
这种行情根本没人愿意进场，只能缩量掏兜内卷最后一起跌。,05-28 10:29
股票人气真难啊,05-28 10:50
2024年第21周（5月24日），本周亏损33310元，年盈利34636元。,05-24 10:26
指数一点红个股跌出翔，装A行情做秀给谁看？？,05-28 10:49
今天大盘会下跌不要问为什么,05-28 10:49
快速冲高，快速回落，稳定向上的动力不足。,05-28 10:49
昨天大盘大涨不赚钱，今天大盘没跌还大亏[滴汗][滴汗],05-28 10:48
今天电力和半导体大基金争龙头阿～虽然上午半导略微落后于电力，但我还是看好资金回流,05-28 10:48
现在多数个股比2600点还惨,05-28 10:38
相约在冬季，我在2400等你………,05-28 10:48
大结构阻力2,05-27 09:31
有没有人能看到,05-28 10:47
现在二只票，仓位是三分之二佳士能多点，中建少点,05-28 10:47
今日是逃命的最后日子，快跑！,05-28 10:47
君禾股份，主力建仓完成，随时暴力拉升,05-28 10:47
自年底开始神秘资金一直拉石化四大行超级大盘股维稳盘面急跌时的恐慌蔓延的情绪，多少,05-28 10:42
看上去大盘没底气，哪的问题？,05-28 10:46
如果你错过了正丹股份，南京聚隆，那你一定不要错过，这只小牛美联新材,05-28 10:14
在这市场炒股，真是越炒越迷糊[捂脸],05-28 10:45
国外都盯着我们的房地产，房地产不好的话，资金也不会进来！,05-28 10:45
哎呀呀呀呀·····,05-28 10:45
销户，销户。还是这个样子。谁进来都没用，整天的这利好，那利好，真是服了。这样分析,05-28 10:45
快跑吧散户们大盘不会上去的不要问为什么,05-28 10:45
这也能红啊！,05-28 10:44
指数涨跌和我无关啊，账户的钱越来越小的[哭],05-28 10:44
现在共流出63亿，融资融券跑了50亿！大盘还红，0.05%,05-28 10:44
砸盘太厉害了，没得玩,05-28 10:44
红利新高了了[旺柴],05-28 10:43
到底谁在拉指数，,05-28 10:04
昨天拉为啥，今天要是来个砸尾盘就有意思了,05-28 10:43
$上证指数(SH000001)$,05-28 10:42
什么在涨啊,05-28 10:42
这个牛市亏得我想哭,05-28 10:34
这个也禁止,05-28 10:42
没希望了没希望了A股没希望了买在2600套在3100,05-28 10:32
上市公司赚的钱拿出来在哪里？分红根本就不是上市公司赚钱的里面拿出来！只是在我们自,05-28 10:42
这个市场的信任度已经没了，建设很难，破坏却很容易,05-28 10:41
这种缩量的状态下，你告诉我半导体产业链大涨，自己估计都不信，超级容量塞道，没有8,05-28 09:45
玩他嘛的单，看好不买的股，大部分都错过，看好买了的股，肯定跌，然后有杠精问了，看,05-28 10:41
跑了跑了，又开始拉贵金属能源了[滴汗][滴汗][滴汗][滴汗],05-28 10:40
这五日线上的费劲,05-28 10:40
阿弥陀佛,05-28 10:39
中国电力＝年薪百万,05-28 10:39
再电一下   心再抖一下,05-28 10:39
50万本金炒股第45天【周一】,05-27 04:25
没有量，上不去,05-28 10:38
每次说想空仓都不能执行，真的无语，这种烂盘面不买就是赚,05-28 10:38
又是一天睡觉行情，浪费时间,05-28 10:38
满仓中涨涨涨啊,05-28 10:38
上不上，下不下,05-28 10:38
黄线在下下午还要深探[哭],05-28 10:37
白银“卷土重来”，这波贵金属弹性为何如此之高？，都是资金推动的，其他解释都是搞笑,05-28 10:31
证卷不红，就靠煤电护指数,05-28 10:28
牛市,05-28 10:37
高盛又加模拟仓了[大笑][大笑][大笑],05-28 10:37
一上一下钱没有了,05-28 10:37
这次技术性牛市归根结底就是超级大盘股的牛市！其他的，可以上蹿下跳，看似热闹非凡，,05-28 10:36
太苦了股民,05-28 10:36
房地产只要出利好，个股就要跌四千多家[捂脸],05-28 10:36
如果光伏锂电不能稳住继续向下,05-28 10:35
啥涨？我股票全是绿的。,05-28 10:35
让散户喘口气吧！,05-28 10:34
小盘股没人要的了.不用救的了,05-28 10:33
上证机构抱团一年半，今年上证抱团机构上证,05-28 10:33
新能源科技已经全部新低了,05-28 10:33
盘中诱多快跑，别当了接盘侠,05-28 10:33
每次我的股来补涨的时候这大盘就掉链子来跌，导致每天跌,05-28 10:33
反正半导体光刻机前天抄到底了睡觉过一个月在来空仓,05-28 10:32
严重缩量，快跑,05-28 10:32
我希望今年主板可以干掉一半的公司，让它们退市，钱真的不够分了，太多花钱的地方。,05-28 10:32
[成交][成交][成交][成交][下跌][下跌][下跌],05-28 10:32
行情曲折起伏变化旡常，让散户不寒而栗！,05-28 10:32
天天涨那么几个，你们就跟跟那几个玩就行了，俺不玩了,05-28 10:32
石油，煤炭，银行天天涨啊,05-28 10:32
管住手。拉指数出货个股中，。,05-28 10:32
清仓销户,05-28 10:32
又是跌,05-28 10:32
热情不高。,05-28 10:32
牛！技术性牛市就是牛！昙花一现的上涨让嫩韭菜迷失了方向！,05-28 09:44
每次美股休假后都会大拉一波，你还是无力。23年这么差高点都3250点,05-28 10:31
任何板块热乎不了五分钟,05-28 10:31
指数上去了个股还在2700[滴汗],05-28 10:07
警钟！明天及未来一段时间大盘有一波较大的下跌行情哟！今天是最后一天出逃机会！个人,05-28 10:30
建议指数下跌，避免心里不平衡,05-28 10:30
两油护盘、市场存量资金博弈、大盘聪明资金天天外逃、靠小作文、传闻、来推动风扇行情,05-28 10:29
以后都不用开盘了，公布一下结果就行了，省的我们看着心烦。,05-28 10:29
每天几千家跌,05-28 10:29
今天估计过不去3135，还得下去,05-28 10:29
指数又红了，何不食糜肉！,05-28 10:07
还是那句话最后说一遍半导体底部点火,05-28 10:07
上证综指3114点是本周之关键位置，敬请密切关注！！！,05-28 09:58
5月23日的大盘走势，能猜到啥？上半场判断3122还得破，下半场杀到3110才止,05-23 08:07
指数拉的真好看个还在2700,05-28 10:07
应该限制机构卖出，实施t+3，散户t+0,05-28 10:06
资金快报　05-28　10:00,05-28 10:06
还不如一起下跌，看着真闹心[哭],05-28 10:06
到底怎么啦？？？？又是4200家在下跌！！！,05-28 09:45
准备开溜,05-28 10:05
周二：字少事大‼继续摔杯,05-28 06:42
光是拉指数没用的,05-28 10:05
牛的,05-28 10:05
你是怎么做到每天只红大盘的？,05-28 10:05
4.30午间短评,04-30 11:29
昨天的涨就是为了今天的跌,05-28 09:42
远离人群扎堆，否则永远都感觉被监控[捂脸],05-28 10:03
$上证指数(SH000001)$,05-28 10:02
指数越拉个股跌的越多，缺德,05-28 10:02
连续下跌可以跌十天半个月。连续上涨两天都做不到,05-28 10:02
每次都是一日情,05-28 10:01
内资天天都在流出，不是好事，还是政策和措施有问题，给资金流出创造了条件。,05-28 10:00
医药外包起飞了,05-28 09:53
唉,05-28 10:00
天天拉三桶油银行，不接盘，你随意。,05-28 09:58
又是4000多只票下跌！,05-28 09:42
半导体表演了，啥时候券商表演,05-28 09:58
内资天天流出砸盘，难道不是故意做空吗？,05-28 09:57
看看这a股的德行,05-28 09:57
只要存在银行保险这样的高股息，就没人愿意冒险买股票了，躺平吃息同时在低点等待股价,05-28 09:40
不要再跌了，股民很惨了。股票都跌了一半。,05-28 09:56
今天竞价时卖出一只票，低价又进去了。现在二只票仓位三分之二，好了，不看盘了，出去,05-28 09:56
不管出什么利好，做空就赚钱,05-28 09:56
2900入的，3100还亏，现在回调，亏更多，我真是不知道怎么说,05-28 09:34
黄线加油啊，我的小票不能再跌了,05-28 09:56
啥时候轮到券商表演,05-28 09:55
以智能化为矛，破局高端，小米汽车重新定义小米,05-28 08:46
又是八千亿的量，睡觉吧,05-28 09:55
又不会破3100铁底。慌个啥，诱空而已。让子弹飞一会儿。,05-28 09:37
指数重回3100，大家赚钱了吗,05-27 10:57
超4000只下跌，上证竟然是红的,05-28 09:31
内资一直流出，这样会有行情吗？,05-28 09:54
你昨天还不如别拉,05-28 09:32
发射东方财富涨,05-28 09:54
昨天都说调仓半导体了,05-28 09:54
京东健康裁撤家医事业部,05-28 09:54
又犯病了，哪来那么多抛盘,05-28 09:42
北证机会来了,05-28 09:53
砖家：开盘4000+待涨,05-28 09:43
3100了，钱还在2700,05-28 09:40
冲,05-28 09:53
指数涨跌都是亏,05-27 09:39
3132，准备跑吧……,05-28 09:52
昨天强硬拉涨，今后这几天要吐出来的。还是等3060附近抄短。可能在黑周四前应该等,05-28 09:42
天天上一当，当当不一样,05-28 09:50
散户，永远是丈二和尚摸不着头脑，不能玩了吗,05-28 09:50
快点直线上拉，诱空该结束了。别磨叽,05-28 09:50
今天要是拉上来，这股绝对以后平步青云，可惜几个老头子撑得住吗,05-28 09:50
想补又不敢补，说它是高位吧，个股这么低，说它是低位吧，指数又这么高，不知道怎么操,05-28 09:38
使劲砸盘！融券做空！,05-28 09:50
指数3100个股2500,05-28 09:37
每天连少亏都成了奢侈……,05-28 09:49
券商不动，大盘上不了3200,05-28 09:49
炒A股的尽头应该是销户了、、、,05-28 09:48
老乡别走，超级利好来了,05-28 09:48
A股中午评,05-27 12:18
现在亏损已经超过一，二月了。。,05-28 09:48
幸亏没进地产，有点利好就高开低走,05-28 09:42
创业板不起来，我看都白费,05-28 09:48
又是4000多家下跌!,05-28 09:31
我的垃圾南矿集团跌跌不休，垃圾股,05-28 09:48
有这么缺德吗？？？,05-28 09:47
牛市一日游,05-28 09:39
昨天大盘涨一个多点我涨0.2个点，今天大盘跌0.2个点我跌2个点！牛逼死了,05-28 09:47
为什么受伤的总是小散户？,05-28 09:47
从5.16日开始防范的日线背离级别的二浪回调开始，时间历时三个半月，空间距离32,05-23 02:02
$上证指数(SH000001)$,05-28 09:47
涨涨涨,05-28 09:40
昨天亏，今天更亏？苦啊谁懂？手上拿着还都正常股有业绩的[滴汗][滴汗][滴汗][,05-28 09:47
地产怎么又跌上了？银行板块今天也不争气,05-28 09:47
国家大基金入市 大盘必跌,05-28 09:47
买哪个哪个跌，卖哪个哪个涨，真服了,05-28 09:46
买在2800点，成功套在3100点,05-28 09:46
科技迎重磅利好！这三大科技风口有望爆发！相关产业链个股曝光！,05-27 06:59
5000多家，基本每天4000多家下跌个股都已经是2600的低点，拉住的指数也不,05-28 09:46
不晓得又咋个回事，又大多数的股票开始跌了,05-28 09:39
昨天大涨我的股票跌，今天跌我的股票还是跌，这是什么原因导致的呢？,05-28 09:46
这哪里是股市,05-28 09:45
天天都亏受不了，基本上天天亏昨天好不容易赚80元，今天一下就亏几千，有这样玩的吗,05-28 09:45
鸿哥财经（5月28日）早盘思路,05-28 08:39
真环保！,05-28 09:34
躺平了，删除软件,05-28 09:38
A股回调统统空仓,05-28 09:45
指数稳定，新股一上，个股跌得惨烈。,05-28 09:45
昨天大阳6只票综合涨了0.5，今天亏了1.5，好啊好啊,05-28 09:45
涨一毛跌两毛来回循环N次钱就没了，我真惨,05-28 09:45
涨的时候个股横盘不动，砸的时候就开始玩命，哈哈哈哈，这市场算是完啦,05-28 09:45
指数没跌，个股跌成狗,05-28 09:45
强，真是震烁寰宇,05-28 09:45
主力资金流出42亿元,05-28 09:45
用量化开盘砸,05-28 09:45
当下市场快速轮动，耐心持股静待风来,05-28 09:45
三千又来了,05-28 09:44
白酒马上[大笑]稍等,05-28 09:44
稍有点行情都是一日游,05-28 09:44
轻松四千家待涨,05-28 09:44
涨三十五点，手上的股票不涨，跌了几点，股票就象滑滑梯一样,05-28 09:44
3100失而复得，然后今天再得而复失[偷笑][偷笑][偷笑][偷笑],05-28 09:44
前天买昨天蒙杀，昨天买的今天蒙杀，真有意思,05-28 09:44
这股市改革很不成功呀，天天闹着玩。,05-28 09:43
欢迎老乡,05-28 09:43
昨天赚3000，今天亏6000，总体亏86万，关键指数没下去,05-28 09:43
天天跌，大盘涨不跟，大盘跌就跟。。,05-28 09:43
天天一日游有意思吗[捂脸][捂脸][捂脸],05-28 09:43
上来就四千多家下跌，全都买中字头去啦？,05-28 09:43
中国股民该醒悟了！,05-28 09:43
昨天回来4千，现在亏5600，跌幅这个是昨天的五分之一,05-28 09:43
大盘真牛。。。。。就是个别指数不争气，砸了1个百分点,05-28 09:43
真是无敌了！,05-28 09:43
还是要跌3100点啊，我还是看戏不买,05-28 09:42
开始回调了，昨天走得太危险了,05-28 09:42
跌多涨少大跌还会跌，大涨一天跌三天。短线得利快点跑，抄底没有底，追高创新高,05-28 09:42
指数涨 韭菜的票跌，指数跌韭菜跌的更惨,05-28 09:42
永远亏，亏光亏光，昨天没涨今天大跌,05-28 09:42
干脆把所有实时数据都隐藏起来，然后开通level200的用户就可以查看，这样更好,05-28 09:41
散户可以买跌吗？,05-28 09:41
我来了[呲牙],05-28 09:41
又是不到20%的股票在红盘上涨，太极端了！,05-28 09:34
今天百分之三附近中阴线,05-28 09:41
大盘3100，很多个股都在2400,05-28 09:41
大级别下跌在路上[摊手][摊手],05-28 09:41
一开盘主力就卖卖卖，从来没有红过,05-28 09:41
这市动不动4000只待涨请问怎样玩！,05-28 09:41
市场这样走，我只有一笑而过，坚守中线持仓，坚守新质生产力,05-28 09:41
牛市！,05-28 09:40
只会拉石油,05-28 09:40
现在的套路，拉盘砸个股。,05-28 09:40
大盘太弱了，缺少资金,05-28 09:40
NND天天都是内狗在砸盘,05-28 09:40
又开始咂了,05-28 09:40
昨天指数大涨，个股涨一两个点，今天指数没跌啊个股一个低开就把昨天涨幅干完了[笑哭,05-28 09:34
不用了吧,05-28 09:39
纳闷了，会不会玩,05-28 09:39
大家有知道今天为什么又跌中信证券又在做空吗？如果是真的把他们都关起来,05-28 09:35
这踏马什么玩意主力天天卖出，不看好市场做什么主力,05-28 09:33
中国石油涨，必然4000家下跌，每天如此,05-28 09:39
昨天进的一脸懵逼[滴汗],05-28 09:34
既然大盘是超跌反弹，反弹20％应该结束了,05-28 09:39
太吓人了。天天跌,05-28 09:39
昨天大涨都没有4100只股票涨。今天微跌随便4200只股票跌,05-28 09:39
有必要非开盘吗？,05-28 09:39
华玉矿业继续表现强劲，机会上周五已经明确提示，文章内容为证，感谢大家支持！！,05-28 09:38
又是四千家下跌,05-28 09:38
每天就一个动作，砸盘砸盘！,05-28 09:38
这么是垃圾行情,05-28 09:38
石油神华长江海油和四千个股玩跷跷板，四只同时红时四千只翻绿。,05-28 09:38
昨天别墅靠海，今天桥洞靠拽,05-28 09:38
现在买公募基金、私募基金的投资者少得可怜，投资者对市场似乎缺少信任感，没有信心投,05-28 09:38
一帮傻个股，先跌为敬，,05-28 09:38
等下再跌破3100点买回,05-28 09:38
黄在白上就好了,05-28 09:20
又疯了,05-28 09:17
鸿鹄复盘系列五,04-28 10:47
技术面来看，三大指数的超短线指标都有修复，但日线走势还处于弱势：沪指今天开盘就将,05-28 09:10
每日要闻概览 | 20240528,05-28 09:15
今天跌多下[卖出][卖出][卖出][卖出][卖出][卖出][卖出],05-28 09:13
大家早上好！今天星期二。祝大家好运，持股都上涨赚钱！,05-28 08:44
上证指数告别3100，5月27日成为低于3100的历史最后一刻！[OKOK],05-28 09:10
5.28  早评   半导体受消息刺激强势上涨，持续性有几何？,05-28 08:20
昨天拉指数出货今天个股指数霜砸,05-28 09:10
今天就看国家队的  站不住3130立马跑,05-28 09:10
5月28号今日市场前瞻:赚钱效应60%左右，指数震荡微涨。关注光刻机和半导体板的,05-28 09:09
关注这个标的！明天还要涨？,05-27 05:44
