context,date_time
原油天图主力资金均线空头排列，只宜逢高做空，具体可以跟KD指标的死叉进场做空,06-06 10:05
中小微是投资机遇多于风险,06-06 09:52
星舰发射成功，明天钢铁大涨,06-06 10:02
服了指数跌股票跌，指数涨股票也跌；成交缩量股票跌，成交放量股票也跌；北向流出大A,06-06 10:01
支持立即取消量化交易！！！#专家建议暂停量化交易！股友们怎么看？#,06-06 10:44
祝全天下即将迎来人生第一考的高三生旗开得胜，金榜题名，记住这句话：“有付出才有可,06-06 04:26
钱没了可以再赚！留得青山在不怕没柴烧。大家保重！,06-06 09:59
3000点就这么难守？,06-06 09:59
用港股通在港股还有一些价值投资标的可以做呀,06-06 09:59
作假者退市是好政策，不加紧研究作假者退市赔偿，退市过渡期延迟没用,06-06 09:59
量化必须禁止！！！#专家建议暂停量化交易！股友们怎么看？#,06-06 09:59
不把内资老虎打掉没得玩,06-06 09:58
2980我来抄底了，噢耶!,06-06 09:58
为什么有T加1仔细想想吧,06-06 09:56
没有量化成交量将少的可怜！#专家建议暂停量化交易！股友们怎么看？#,06-06 08:38
量化转融通不死，股市不活#专家建议暂停量化交易！股友们怎么看？#,06-06 09:53
行！感觉喊痛的！充大神的。分析后世的都少了！跌！亏损！让参与者哑口无言。还能说啥,06-06 09:53
财联社6月6日电，纳斯达克综合指数盘中创下历史新高，达到17233.66点，日内,06-06 09:53
3000保卫战能否取得胜利[想一下],06-06 09:52
千年老妖，又到千杀的保卫战时刻[捂脸],06-06 09:52
销户不玩了亏损一塌糊涂,06-06 09:51
微盘股快速下跌，现在怎么办？,06-06 07:42
2024，港股IPO开始回暖了吗？,06-06 08:38
#专家建议暂停量化交易！股友们怎么看？#这个暂停了，只有改T+0交易,06-06 09:29
取消！取消量化！,06-06 09:48
实盘记录（第20天21天）,06-06 03:21
我一看到大盘股，就觉得本能的恶心想吐，所以前日清仓小盘股后，我宁可空仓，也不入任,06-06 08:28
股市想好转，正常发展，唯一的办法，就是新股发行时，所有的原始股股票，按发行价价格,06-06 09:46
有量化三千点必破#专家建议暂停量化交易！股友们怎么看？#,06-06 09:42
持仓4只股2只创4年新低了，加起来亏损幅度超过120%了,06-06 09:41
市场弱势的原因找到了,06-06 09:40
微盘股该反击了[上涨][上涨][国家队][国家队][国家队][国家队][国家队],06-06 09:40
这背景都能退市？？能玩？今年是要把小票杀疯啊！能挺过这波盲杀的小票必定大牛。,06-06 09:18
操太猛了#专家建议暂停量化交易！股友们怎么看？#,06-05 08:56
3000必须到，到了之后再看情况如何发展,06-06 09:30
A股，待涨今天市场是缩量下跌，三大盘全部是下跌的，上证指数跌幅相对较大，收盘结果,06-05 10:50
市场再次唱响3000点保卫战，其实这个位置没必要太悲观！,06-06 08:04
加速下跌,06-06 08:33
大盘明天怎么走,06-06 02:22
请你们不要护盘，让它自生自灭,06-06 08:32
不知道今年能到6000家上市公司不,06-06 08:29
$上证指数(SH000001)$,06-06 08:29
最想说的是：已然99.99%的股民如此的反对和反感量化交易，为什么就不能让其停止,06-06 06:59
A股大跌、长电新高，中信证券：牛市要来了！,06-06 07:35
反抽后清仓，3048不是底，空仓等待。中字头砸盘的话短期就不进了。,06-06 08:26
反包阳！牛回速归？,06-04 11:45
股市要文明制订政策与管理,06-06 08:25
为什么长江电力上涨十年,06-06 08:25
今天大家亏了多少？报个数[笑哭][笑哭][笑哭],06-06 01:46
印度2003年也出现过像我们现在一样大规模清退垃圾上市公司的情况，那时候印度一共,06-06 04:19
估计明天继续暴跌，赶紧清仓走人,06-06 08:23
散户为啥不去买中国神华呢，,06-05 11:26
空仓也能赚钱，哈哈,06-06 08:21
本金怎么缩水的,06-06 02:19
#专家建议暂停量化交易！股友们怎么看？#量化交易追求的是超短期收益，再好的市场环,06-06 07:59
不见中阳打死不进场了，这次一定要管住手,06-06 08:19
6.6 垃圾堆里捡宝贝的市场,06-06 08:08
赖皮,06-06 08:18
半年三次系统性风险，棒棒哒[大笑][大笑][大笑][拜神][拜神][拜神],06-06 07:59
看好A股，我都开始抄底了，不过这看着真惨啊。希望我不要被埋了,06-06 03:16
收盘一看，下跌4808只下跌，509只上涨。关健是国内大资连续每天净卖出！今天又,06-06 03:07
小盘股赶鸭子下架去接炒高的大盘股，老本亏光了无力接盘了！,06-06 08:17
这股吧一群叫多就是！跌2800下去，还在看多，害人！,06-06 08:17
终于逆市翻红了，难得吖,06-06 07:09
国际组织带头积极看多中国！影响几何,06-06 10:51
6月1日：下周大盘走势预测的探讨(6月3日…6月7日),06-01 07:52
量化交易的辉煌时期或将终结,06-06 08:15
6/6龙虎榜分解,06-06 07:03
模拟仓已打满，今天小亏,06-06 08:01
呼叫远古长阳，六月正在酝酿。,06-06 08:11
年度跌破面值退市估计要3000家！保重,06-06 08:07
#专家建议暂停量化交易！股友们怎么看？#买股票送老婆我也不买了[龙头],06-06 08:07
微盘股的今天就是大盘股的明天，谁也别想躲过。,06-06 07:45
微盘股：前有狼后有虎，只有微盘股在吃苦,06-06 04:06
捡漏退市园城一天三倍，2024最强策略出现,06-06 10:54
午盘分析0606,06-06 12:51
复盘,06-06 08:04
再度开启3000点保卫战！,06-06 08:03
6.6收评 市场放量下跌，风险加速释放,06-06 08:02
买新不买旧,06-06 08:01
下半年，百分之百最次会见到2900点，也许还会低,06-06 08:01
选不好票今天肯定挂，唯一大跌的300292上午保本就跑了，中午已经发帖提示，，其,06-06 08:01
现在的大盘指数都是假的，就是为了他们清仓那些小盘，聪明人赶紧逃命,06-06 06:20
杀出恐慌盘，然后有业绩有分红的小盘股就有机会了。但是记住，亏损的垃圾股一定要远离,06-06 07:56
今天已经清仓了，坐等6月19号陆家嘴大会。不禁止转融和量化，不出台退市赔偿机制，,06-06 07:56
周线不保了,06-06 07:56
科技股以后不能碰。都是炒概念,06-06 07:53
$上证指数(SH000001)$,06-06 07:22
个股票跌这么多，大盘没怎么跌，这也太假了。,06-06 07:24
开盘清仓卖出星湖科技，短线进军南京化纤。,06-06 07:47
明天来一次低开高走吧,06-06 07:47
低价股暴跌完全因为st股大面积退市引起，强烈呼吁管理层修改1元以下20天退市的规,06-06 12:47
以前逛商场逛超市买东西从来不看价格，自从进了股市，一是商场超市明显逛的少了，二是,06-06 07:45
存款搬家，这类基金或成为短期理财首选,06-06 09:41
股市随心笔记（6月6日）,06-06 07:44
大盘日线级别的顶背离，这几天的调整不是很正常吗？为何非要找各种理由去强行解释这波,06-06 07:21
早知如此何必当初呢，一百万放银行存款利息也够吃饭了,06-06 07:33
不抬扛，继续下跌,06-06 07:42
个股走出退市的节奏。各种跌特别小盘股跌的太多了。,06-06 07:42
关闭量化，关闲转融通#专家建议暂停量化交易！股友们怎么看？#,06-06 07:41
以前每个月可以上万零花钱消费，炒了股现在可以省两年不用消费了,06-06 07:32
明天开盘就跑！！！,06-06 07:28
明天如何,06-06 07:27
北向资金净流入67亿,06-06 07:38
部分主力机构仓位在30％左右。   4月28日、29日和5月6日反复提示“五一假期后机构将逐步增大减仓力度”。从两市主力机,06-06 07:37
七大公募基金一致认为：A股市场利好因素汇聚，中长期投资价值显现！,06-06 05:20
退市也能挣钱,06-06 07:34
自选股跌成狗了，大盘居然不动，牛,06-06 07:34
建议加息5%,06-06 07:34
不知道大家相不相信？我是从广州第一间证券营业部开业开始，开户买股的。从散户，进中,06-06 05:05
明天会不会3000点保卫战,06-06 07:25
说好的牛市呢？,06-06 07:11
