context,date_time
今天以半导体芯片为主导的科技股继续风起云涌,05-28 09:05
兄弟们早上好，利好继续今天周二的市场，会有一点不同。如果开盘低开破3123，那么,05-28 06:45
今天依然会有大量机会的,05-28 09:06
预判5月28日星期二大盘会这样走！！！,05-28 12:41
……,05-28 09:01
明天大盘就是一根大冰棒，今天量都没有，二月份到现在整个反弹的结构已经走完，周线级,05-27 03:27
今天最好是下跌，炉架底走势,05-28 09:01
5月28日星期二。No.1盘前热点事件一、上海发布关于优化本市房地产市场平稳健康,05-28 08:59
未来的一两年牛市肯定到来，毋庸置疑，但牛市到来之前至少有80%的散户已经没了本金,05-28 08:47
立贴为证！投入20万新开实盘，挑战一年做到一百万。第52天！欢迎广大朋友们关注见,05-27 03:07
早盘计划机器人+虚拟电厂+智能电网一切按计划执法，昨天的创意通今天冲高就跑！简简,05-28 08:56
想想当年的求学之路，就明白现在的投资之路,05-28 07:28
转发,05-28 08:54
一，释放失责必问、问责必严的强烈信号昨天下午重要会议召开，会议主要有两个议题，一,05-28 08:09
每日热点总结；2024-5-27周一复盘！老规矩每天聚焦市场热点！关注不迷路！让,05-27 11:50
空仓第十九天，继续空仓,05-28 08:52
大家早上好！今天星期二，祝大家好运，持股都上涨赚钱！,05-28 08:52
如果你想要炒一辈子的股票，那么这11条经验总结一定要看，可以助你在股市少踩坑，句,05-28 05:59
电子行业迎风起航，券商聚焦潜力赛道,05-28 08:52
强弱分界点，方向抉择,05-28 08:50
券商大跌，小心点,05-28 08:49
种种迹象表明，A股的未来值得期待，3件事情分享下，直奔主题，与铁粉息息相关……1,05-24 09:22
《妙妙早盘预判-24.05.28，周二》,05-28 08:41
三大股指全线收红，周二的A股市场会怎么走？,05-28 06:42
半导体起来了，专精特新014736今天估值上涨了3%，有大基金的3440亿元子做,05-27 06:09
这波3600点没问题，还要涨一个月,05-28 08:34
融通暂停应该不远了。比如，上市公司老板将股票借出去了，给了他,05-28 08:30
反弹中的隐忧,05-28 08:21
小箱体整理是近期的趋势,05-28 08:24
风险未解除,05-28 08:23
【国有大行H股获增持！】,05-28 06:07
今天多空主力将争夺20日均线，上证指数站上3130点等待新的机会。煤炭，石油，券商，房地产拉升逢高减仓哦！退市板块坚决离场。,05-28 08:21
【正虹9天6板九州涨停！】,05-25 06:32
今年行情高点已现，幻想的韭菜兄弟们好好,05-28 08:21
豪哥实战A股：重磅，四大利好密集来袭！明天再不继续涨就真说不过去了。明天大盘会这样走！,05-27 10:25
如果你在5月6日那会看到我的帖子买了房地产，那这个月应该赚的盆满钵满了！,05-23 10:53
今天是上午大涨，下午回落,05-28 08:14
完全是存量在玩，今天冲高回落,05-28 08:14
回调两天之后，开始看修复,05-27 08:53
房地产已倒，电力加速放量已面临见顶退潮，接下来请看科技接力[大笑][大笑][大笑,05-27 02:11
上海发布关于优化本市房地产市场平稳健康发展政策措施的通知昨天下午上海发布房地产政,05-28 08:09
昨天姿势不错！今天调整上车。,05-28 08:09
准备仓位打满，月底冲刺了,05-27 10:45
周一收盘及周二5.28走势展望:,05-27 11:55
半导体：据天眼查，国家集成电路产业投资基金三期股份有限公司5月24日注册，注册资,05-27 09:30
5月27日晚间重要信息精选,05-28 08:01
昨天红了才有戏，否则完蛋了,05-28 07:59
半导体涨的欢，平均市净率4倍，光伏屡创新低，市净率1倍.银行平均市净率0.8倍，,05-28 07:54
市场摘要,05-28 07:53
今天你不往上关窗！我清仓！！！,05-28 07:52
今天是不是又要暴跌了？[摊手]创业板跌2%以上,05-28 07:51
#沪指收复3100点，A股重拾涨势？#下跌调整的一次反抽，说止跌为时过早。,05-28 07:47
$中韩半导体ETF(SH513310)$24-5-24下跌却大额买入，后续多跟进！,05-28 07:45
【点赞交易所问询16跌停！】,05-28 07:43
【大基金投向何方？】,05-28 07:42
昨天大A反弹，三大股指都收出了红盘，其中上证指数大涨1.14%。但成交量却仅仅7,05-28 06:35
【六大行参股大基金三期！】,05-28 07:42
【国泰君安海通合并？】,05-28 07:42
#“沪九条”打响楼市新政后第一枪#5.27日，星期一，收盘数据,05-28 07:41
【27日北向资金动向！】,05-28 07:41
A股：消息来了，一觉醒来再次被利好镇住，今天周二这样走,05-28 07:38
[献花],05-28 07:37
开启新一轮减持,05-28 07:30
如今这行情没有新的韭菜进来，只能是拉拉指数,05-28 07:29
不同题材的空间板卡位战精髓——以转强的预期，去对付转弱的预期。这也是孙子兵法中所,05-27 08:25
5月28日盘前思路,05-28 07:24
摩根大通：全面看好A股已经在模拟仓把A股调成满仓，你看好就真金白银干，模拟盘我嘞,05-28 07:23
今天中部六省会如何表现？哪个板块先崛起呢？大伙儿加把柴！[拜神],05-28 07:23
消息来了，一觉醒来再次被利好镇住，今天周二只会这样走。,05-28 07:20
万物皆周期，特别是情绪周期。,05-28 06:27
海越能源#大利好！“史上最严减持新规”升级落地##沪指收复3100点，A股重拾涨,05-28 07:19
目前行情，整体看好，逢高减仓，等低买入，增加筹码为主,05-28 07:19
有的人说正丹股份50－100元，都是，今天下跌跌停给你好看。,05-28 07:11
控制持仓，谨慎操作,05-28 07:10
A股：明日大盘指数预测，真的反转了吗？提前奉上预判,05-28 12:44
一周没怎么看盘，都跌回来了！,05-27 08:52
昨天A指虽然如期收复上周五失地并反包阴线收阳，反弹力度符合预期并不意外，但量能远,05-28 07:02
中央政治局释放重大利好、推动中国经济、金融股市向好不变、更有利于中国科技的发展、,05-28 07:00
继续大跌，都去抄底上海的老破小了[旺柴],05-28 06:59
今日大势预测20240528ABABA短线中线2114点(20月均线)附近均是关,05-28 06:52
3100点以退为进，大金融，房地产，高分红成为风口。关注政策面，消息面，情绪面变化，快进快出，切记追涨杀跌哦！,05-28 06:53
转发,05-28 06:52
好运连连。岁岁年年花相似，年年岁岁股不同啊。同一只股票，不同年份的同一时间的股价,05-28 06:51
上海：探索在嘉宝智慧湾未来城市实践区建设城市电力充储放一张网“虚拟电厂”5月27,05-28 06:32
捷捷微电,05-28 06:45
说句实话，现在大A一般散户真的玩不了，电风扇行情，一天一变，今天追进去明天基本上,05-28 06:42
2024年笑看4202点，[胜利],05-28 05:48
#沪指收复3100点，A股重拾涨势？#小作文：村里正在退市赔偿条例征求意见。现在,05-28 06:34
2024年5月28日,05-28 06:33
第三期国家大基金进场布局大科技板块，多家国有大银行真金白银大力支持。昨天3100点失而复得，今天板块轮动，高卖低买哦！,05-28 06:31
2024  制度建全元年,05-28 06:24
老大早安[献花][献花]恭喜您发财。这次反弹，若有10走[微笑],05-28 06:24
量不上9千亿，指数难上3150上方，3050至3180还的走一段,05-28 06:14
今天北向资金净买入27.48亿，也挺有意思，以后是不是只要看到当天涨了就可以判断,05-27 10:57
这个消息逻辑上对次新股是实质性的重大利好,05-25 01:12
《A股今日表现及个人对后市的看法》,05-28 06:12
量化好像被严控了,05-28 06:08
在下跌波中，中长黑，次日高开高走过黑k的开盘价，在k线理论中这叫下降反拖线。预示,05-28 06:07
【券商先于基金调研这几股！】,05-28 06:06
【牛股都是从涨停开始！】,05-28 06:06
抵挡住诱惑，为守住自己的个股大基金成立我也不会去追相关股票。,05-28 05:54
$中证2000(IS932000)$$中证1000(SH000852)$$上证指,05-28 05:49
60金叉250，4202点[吃瓜],05-28 05:47
高概率交易模型：量价关系分析！！！#半导体产业链活跃，持续性几何？##沪指收复3,05-28 05:37
市场这种量能能大涨才怪，今天看跌,05-28 05:29
5月28日大盘上午走势预测,05-28 05:23
3400亿的国家大基金就是芯片半导体的药引子，重点关注杨帆新材，富乐德。另:房地,05-28 05:14
【英伟达还有新高！】,05-25 06:33
转发,05-28 04:51
利好？警惕！诱多！！,05-27 10:08
本次牛市突破6124点很难吗？只不过翻一倍,05-27 09:00
现在市场上的一切行为举止都是在酝酿更大的进步，相信我们的国家,05-28 03:29
A股的核心资产通常指的是那些在行业中具有领先地位、业绩稳定、具有核心竞争力的优质,05-28 03:22
为何宁德股跌了这么厉害啊,05-28 03:09
002358森源电气，这个股价还有基本面，还有业绩的稳步增长，个人感觉股价被低估,05-28 03:02
完了四年，靠的就是胆子大,05-28 02:32
CY每日推测5月28：今深证成指看跌，6种情况$上证指数(SH000001)$,05-28 02:34
20240526[量化技术分析]A股主要指数每日收评,05-26 04:07
上证指数会像以太一样上涨吗？走势真的很像,05-28 02:18
拉了一个点盈利170元前4天跌亏34000.这样怎么玩,05-28 02:17
怎么买这个股票新手入门,05-26 06:33
兄弟姐妹们晚上好，明天猎场金股已选好了，想要的点赞回帖一波！让胖哥看看有多少人？,05-26 09:29
今日光刻机（胶）主唱！实际光刻胶没什么大的科技含量，而这板块95%的股票涉及光刻,05-28 01:35
炒股，要么不出手，要出手三到五次便可炒股养家，长期在市场里总结出的经验，望采纳，,05-27 06:36
1.4%的阳线站在3090线上，说明日线平台上沿线，在工作。,05-27 07:05
A股：放量大跌，跳水的原因找到了，接下来只能这样走,05-23 04:57
别跟散户说什么牛市了，除了上证指数上了年线，其余各指数离年线还差得多，算什么牛市,05-28 01:07
002598来个涨停吧,05-28 01:04
A股强力反弹，3440亿重磅利好来袭，国家队大福袋减空3243手，冲冲冲,05-27 09:50
减持新规利好，明天有中阳反弹行情，3070点有强支撑,05-26 02:21
2亿股民这个牛不知道是谁吹出来的，反正我身边的人50个都可能没有一个人炒股。。所,05-28 12:32
模式趋向稳定：今日收益+10,05-27 08:37
沪指涨1.14，纳指才涨1.10，我们终于要崛起了[色],05-28 12:08
你们挣钱了没有，大盘这个月没怎么跌，个股却跌成狗[微笑],05-27 07:05
5.27指数大涨，明天怎么走？,05-27 11:54
5/27号股市点评，调整还会继续。,05-27 08:55
今日走势符合上周五分析，反弹，虽然没碰我预计的3060但反弹的走势是没有问题，但,05-27 03:13
《小钱靠命，大钱靠德》,05-27 11:39
好像每年欧洲杯大A都跌厉害,05-27 11:09
股民盼涨殷切#沪指收复3100点，A股重拾涨势？#,05-27 11:34
马斯克的AI棋局：算力超级工厂与扎克伯格的较量,05-27 11:32
大盘回到了3100我的钱却少了七万[大哭][大哭][大哭][大哭][大哭][大哭,05-27 11:31
今天的行情行情，如果如早上走法收盘，那就太打脸了。下午虽然脸面有点光彩，量却少的,05-27 11:11
国家大基金一期累计投资1387亿元，并成功吸引高达5145亿元的社会资金。国家大,05-27 11:29
大盘走势别走的跟4月15和16日一样，今天涨，明天一个大跌,05-27 11:14
这个市场到处都是雷，我的天，什么鬼,05-27 11:22
"美股分红需要除权除息吗_百度文库美股分红只除权,但没有我们所谓的除息,并且这个除",05-27 11:21
#沪指收复3100点，A股重拾涨势？#大盘涨，可不影响亏钱呀[奸笑],05-27 11:13
明天调整，跌。,05-27 11:11
今天市场的上涨后面如何操作,05-27 11:08
电风扇还在继续,05-27 08:13
继续等待，切换更适合的账户，主做短线，做好亏损的准备。,05-27 11:07
已经分不清是国家三期大基金救了半导体，还是为了三期大基金的建仓而长期打压国内半导体股价,05-27 08:44
国家大基金三期（国家集成电路产业投资基金三期股份有限公司）于5月24日正式成立，,05-27 11:02
胡锡进今日亏6869元，累计亏损4.83万元,05-27 04:59
转债市场三大怪,05-27 08:44
你与游资最大的区别是什么？我一直在实践，一直在思考，我和那些著名游资到底差在哪？,05-25 04:56
欧洲央行即将降息，已经成定局！,05-27 10:48
北上怎么又看到了啊,05-27 10:56
#沪指收复3100点，A股重拾涨势？#新三板才是归宿,05-27 10:42
夜已深，分享3个重要消息，直奔主题，明日，A股会迎来“变脸”吗？1、高盛：中国股,05-26 11:56
量价背离,05-27 10:38
散户们争口气，努力做到把国家大基金站岗，支持的点赞,05-27 10:38
据媒体报道，马斯克在日前的xAI活动上强调了能源效率的重要性。他指出，“（在AI,05-27 10:35
只发图,05-27 10:35
重视一下电力方向五日均线之上的个股,05-27 10:32
缩量等于轮动,05-27 10:29
要说的都说了，还是等待吧！耐住寂寞比耐住疼痛好些吧！,05-27 10:26
28日调整,05-27 10:25
上证指数重回3100点，你认为现在投资A股是高了还是低了？,05-27 08:08
今天对大盘三大指数上午故意跳水洗盘的判断完全正确，困境反转板块滞后一天，明天也可,05-27 03:01
上证指数运行轨道图解目前，上证指数在120分钟支撑位，找到了箱体底部。明天的压力,05-27 10:20
一年两次分红的上市公司有哪些，除了这张图，还有吗？,05-27 10:16
追涨杀跌的人亏损99%，而且很快；在低估值埋伏的人赚钱99%，但是要时间很久。,05-26 04:36
今天切了半导体，光刻胶。明天又准备切哪个板块。,05-27 10:11
5/27详细龙虎榜,05-27 08:31
这里评论可回复。[微笑][微笑][微笑]感谢东财平台支持！[抱拳][抱拳][抱拳,05-24 07:59
会不会又是一日游,05-27 09:50
欧洲杯还有半个月开始，以双象股份为首的概念股己开始预热，抓紧布局了，等到高潮时只,05-27 10:00
30万实盘记录（第12天）,05-24 03:53
A股周一午评：直接高开又留下缺口，下午又要回落？,05-27 12:52
重回股市重回股吧,05-27 09:55
重仓大A的证券不给力啊。明显跑输上证。,05-27 09:16
不要因为一根阳线就改变看法，下跌趋势不变。,05-27 03:41
买了蓝筹兰州银行到今天为止还被套30%[怒],05-27 09:47
反弹明天很关健，突破五日均线才是第一步。今日反弹有一定的获利盘，这二者结合起来看,05-27 09:47
5月基因跟踪4,05-23 05:49
实盘实录好久没有更新。如你想象的，亏了呗，亏惨了。年前两天亏得惨不忍睹，年前最后,05-23 04:59
投资理财，学会核心卫星策略搭档指数基金？,05-27 09:39
大盘被8周均线撑住了，下一步看能突破到3200点不。,05-27 06:24
要切实抓好《规定》的贯彻落实，坚持严字当头，敢于较真碰硬，敢管敢严、真管真严，释,05-27 09:37
A股：预判全对，明天周二，（5月28号）大盘走势已定，大盘会这样走！！！,05-27 07:42
夜已深，关于明日A股的行情，我再强调几点，防止有人没有看到：1、今日大盘高开震荡,05-27 09:36
大盘涨得真好，隆基半死不活！,05-27 09:08
大盘突破颈线后，回踩确认，颈线处获得支撑。阳包阴，再次开启上涨模式！！,05-27 09:27
20240528关注方向,05-27 09:35
两大利好，明天A股继续上涨。,05-26 01:30
【富神】5.27热点——半导体（光刻机）,05-27 08:21
期指交割完又可以拉升了，到6月期指交割又砸盘！,05-27 09:29
来个慢牛长牛吧让股市更健康有投资价值而不是投机,05-27 09:27
盘中临时挖掘与二次判断：抓住超短机会,05-27 09:25
主升斗金炒股之旅（附.股 5.28）,05-27 09:20
#沪指收复3100点，A股重拾涨势？#我还在2700点呢！！我还没上车呢！！[哭,05-27 09:17
一成仓位最好。,05-27 09:17
明天满仓冲3400,05-27 09:16
5月27：大盘缩量修复，半导体光刻机爆发，持续性如何？,05-27 05:07
好多的标准十字星啊。头一次见这么多的个股，呈现出标准的十字星,05-27 09:15
$上证指数(SH000001)$$创业板指(SZ399006)$$恒生指数(QQ,05-27 09:13
坐稳扶好，满仓待涨,05-27 09:13
跨境出海！今天周一中国股市的跨境电商板块突然大涨发生什么？具体原因是这样的，给2,05-27 09:11
5.27 又轮到半导体，每天整一个新活,05-27 08:06
对于今天的行情，灵儿早就已经提示：修复性反弹。主要是资金面上压力太大，市场各路资,05-27 12:09
《最严减持后今日低开高走，后续如何应对！》,05-27 09:06
炒股的人人人都是败家子，都是畏缩萎靡不振失落。要把不炒股作为家规教子孙后代。开设,05-27 08:58
兄弟们中午好，虽然上周连续两天普跌、沪指直接跌破了3100点，但是今天直接高开，,05-27 12:22
百度搜索；根据提供的信息，司马懿马哥的前瞻性预测表现出了极高的准确性。以下是他的,05-26 06:03
运气,05-27 08:41
十年磨一剑，归来仍是少年！,05-26 11:17
不好猜，再来猜,05-27 03:01
这回3100稳了吧,05-27 08:50
2024年5月27日连板数据,05-27 06:22
珈伟新能(300317.SZ)：目前已拥有多家海外子公司，海外销售网络已遍布美国,05-27 07:42
网传现在有的上市公司退市了还摆庆功宴！,05-23 10:35
#沪指收复3100点，A股重拾涨势？#浪潮云海云桌面虚拟化系统InCloudAc,05-27 08:50
大跌原因找到了 史上最严减持新规如何解读,05-25 12:24
a股牛市就要来了，持仓的朋友可以稳定信心，没买的朋友也可以买入了，牛市就在今年下,05-27 08:44
5月27日热门个股一览1.明星电力：放量新高，五日生命2.百川股份：放量烂板，消,05-27 07:36
指数已经回来了，但是我还亏四万多，去年这个时候账户有十二万多，现在只有八万,05-27 08:41
“一日游”策略选股  24.5.27  今日又又又又小亏,05-27 08:41
上证指数周一触及3174点后连续缩量调整4天，这也是放量突破牛熊分界线的一次回踩,05-26 09:32
两市平均每只股票交易额只有1.6亿元！,05-27 08:40
一分钟反抽！,05-23 11:06
转发,05-27 08:35
没有天天涨市场。回调很正常。握住票子，看准！,05-27 08:33
今日A股市场呈现涨多跌少的态势，大盘指数集体收涨，成交额有所增加。板块方面，光刻,05-27 08:30
【上海楼市】调整优化住房限购政策,05-27 08:30
今天A股如期反弹，5月红稳了吗？？,05-27 03:40
刺激！大基金三期来了，芯片怒涨超过3%！,05-27 03:33
今天打鸡血，明天打回原形,05-27 08:24
空仓的家人们再给你们聊聊明天大盘的走势，明天有个五分钟级别的回调，就是你们建仓的,05-27 05:19
奇怪了今天，大盘涨了那么多都没人出来的？以往一大推出来叫牛市，超级牛的。唱多,05-27 06:49
我确定牛来了，和之前一样,05-27 08:21
看一看龙虎榜，营业部抓妖,05-27 08:21
参考之 所有人都懂,05-27 07:58
房地产利好算笔帐：首付下降，本息和上涨！,05-27 11:03
大家都不唱3200了[摊手]估计3200要来了,05-27 08:16
喜呦，明天又可以痛快的割韭菜散,05-27 08:15
券商、光伏、军工等板块的后市看法及操作策略！,05-27 08:14
周二继续冲高回落，上涨家数减少！,05-27 08:11
明天如果放量上涨或恐慌杀跌都是机会，就怕他没有波澜,05-27 08:10
3124.04，明天死定了,05-27 03:15
今天的大盘就是下跌中继！！！大家千万管住手！！！现在是下跌中继！！！,05-27 08:07
明天5月28日A股：尾盘又异动了，股市集体拉升，发生了什么事？,05-27 07:50
#沪指收复3100点，A股重拾涨势？#,05-27 07:57
《证监会减持新规后大盘走势观点》,05-26 10:56
明日预判，冲高回落,05-27 08:01
支持股市,05-27 08:01
收复3100，这次半导体不一样？,05-27 07:59
大牛市大牛市大牛市,05-27 07:51
没人买，998.23见！没量了,05-27 07:22
从日经、债基转到亚太精选159687，成分股台积电、三星都大利好，接下来大涨#电,05-27 07:56
今天涨停45家，我抓了3个涨停！,05-27 07:50
下午电力板块被光刻胶抢了风头，希望明天众智能让我体面出来，亏到三月不知肉味了。麻,05-27 04:20
浅谈3200点为何成为今年乃至明年上半年的重要压力位,05-25 05:14
周一收评：惊人相似的历史走势！这个时候不用怀疑，市场答案早已揭晓。接下来盯紧这两,05-27 06:39
5月27日复盘，市场反弹的太假了，谨防继续调整,05-27 07:34
这个模拟盘有点不对。上午应该是10:30抄底的中证1000和双创。结果变成了沪深,05-27 02:39
3140附近开空,05-27 03:46
珈伟新能(300317.SZ)：目前已拥有多家海外子公司，海外销售网络已遍布美国,05-27 07:43
明天早盘拉升赶紧跑，还会调整的,05-27 07:43
#沪指收复3100点，A股重拾涨势？#顶天了就是个弱三买，要是没半导体这个利好刺,05-27 07:42
这种分时走势可谓叫强了！为什么机构还要砸，大盘才几个点[为什么]难道这就是机构要,05-27 07:19
好的公司，政府才会大力支持，补助一个多亿，还有谁？正丹股份，宝丽迪,05-27 07:32
大V反转，十年长牛重启征程！,05-27 07:10
早盘清仓卖出宗申动力，短线进军鲁北化工。,05-27 07:29
会不会有合作呢，节水设置，结合前两天更改经营范围[大笑][大笑][大笑],05-27 02:30
今天发生一件大事，就是正源股份在没有任何利空和没有ST的情况下被杀到面退了，感觉,05-27 07:23
看起来非常可能是主力资金打压吸筹进行中？！涨一下，跌一下，不断反复，便宜筹码就到,05-27 07:23
下跌浪中的中途休息,05-27 06:08
无量反弹，下跌中继，继续看跌,05-27 05:52
新规落地，大股东减持“顶风作案”？兄弟们怎么看！,05-27 11:09
拉尾盘反弹无量,05-27 07:16
是不是应该很满意？,05-27 07:15
大盘今天涨的因为利好，明天就不一定能持续了，如果没有好的选择现在这盘面还是观望好,05-27 07:14
大家今天都赚钱了吗[滴汗],05-27 07:13
还能回本吗？兄弟们[哭],05-27 06:35
A股今天缩量拉指数，市场卖账的可能性有几成？,05-27 07:07
A股：收评，磨盘调戏！,05-27 03:09
真神奇，个股跌，指数涨,05-27 06:41
明天直线下挫！,05-27 06:56
信心和人气也得用真金白银换来的！,05-27 06:55
价值投资来了,05-27 06:33
大哥们，还有玩下去的必要吗？,05-27 11:44
必须要有赔偿机制，不是退市就可以的事,05-27 05:46
必须要有赔偿机制，不是退市就可以的事,05-27 05:46
麻了，库死了，指数还是大涨的,05-27 06:19
别画图别说话别猜想！因为你不是做局者！你们不会傻到现在还不明白吧！为什么几十年三,05-27 06:51
这么一点量涨啥，洗洗睡吧,05-27 06:50
买在2600，亏在3100,05-27 06:02
2024年05月27日大盘总结（预测准确）及05月28日大盘预测,05-27 06:46
6月到8月大盘让你想不到的一直往上走。,05-27 06:44
#沪指收复3100点，A股重拾涨势？#,05-27 06:37
大盘即将暴力反冲。目标3400点[微笑],05-27 06:32
A股进入这波反弹最后的冲刺阶段！目标新高！,05-27 06:31
一年亏50%的同事，问我A股都博士毕业了，怎么还赚不到钱？,05-27 11:14
【基于群体博弈的股市运行之道】,05-27 12:18
之前哪位大哥总结的规律每个月20号之后就跌跌几天就开始反弹这个月好像也是这种情况,05-27 09:35
【欧奈尔每日市场回顾-24/05/27】煤炭、航运、有色金属表现优异,05-27 06:25
2024年5月27日，十284。,05-27 03:45
上海沪工大股东舒宏瑞变相“清仓式”减持，与现在减持新规唱对台戏，实是胆大妄为，呼,05-27 06:24
芯片鸡精规模超预期！,05-27 06:02
明天继续涨，我已经打满模拟仓了,05-27 06:17
今天的反弹是诱多，没有主线，很凌乱,05-27 06:17
无量上涨，跟进不敢。,05-27 06:13
防范化解金融风险问责规定（试行）》，就是要进一步推动在金融领域落实全面从严治党要,05-27 04:57
记录6万挑战100万的艰辛之路，2024年5月20日起步日。,05-27 05:36
周末复盘05~26,05-26 08:58
明天可能会继续小幅拉升#大利好！“史上最严减持新规”升级落地##沪指收复3100,05-27 05:58
抓住绩优股，避开绩差股，优其是sT股。,05-27 05:57
长安汽车：跌出了我的新认知,05-27 02:39
创业板指数“三兄弟”居然如此不同,05-27 05:53
芯片半导体炒作持续性预测,05-27 05:52
超长期国债给债市“上一点强度”，短债基金“赢麻了”,05-27 04:32
关注这个标的！明天还要涨？,05-27 05:44
就这个量可以冲上3100？明天连这个量都不要破3100,05-27 05:44
反抽五日线，周二阴包阳,05-27 05:44
【大户赚10倍不撒手，散户赔一元就止损！】,05-25 06:38
明天继续破3100,05-27 05:42
坐等牛市来，别墅靠大海！,05-24 08:46
5.27早评|周末突传利好！影响A股本周下跌吗？,05-27 08:47
指数越高，钱越来越少。销户越来越多。,05-27 05:36
