context,date_time
个股和指数真有关系吗？,06-06 02:42
看来要割肉了，远离股市，,06-06 02:42
我就知道大家最近半个月过的是否可好[关灯吃面],06-06 02:42
罕见！A股这只票暴跌99%，st园城是中国的伯克希尔吗,06-05 12:43
吃饱了吗主力大人们[晕],06-06 02:42
尾盘拉红[大笑][大笑][大笑],06-06 02:42
大家抄底啊，本人看是机会，国莫队会救市的，散户可以放心抄底。,06-06 02:42
既然没什么牛市，那些蓝筹股是不是也应该跌下来[捂脸],06-06 02:41
市场慢慢走向成熟都需要经历苦难，近期整个行情基本上符合预期，情绪不要被那些视频号,06-06 12:27
又要3000点保卫战了,06-06 02:41
#专家建议暂停量化交易！股友们怎么看？#看似机构赚到钱了，散户人均十W都不到，亏,06-06 02:41
大家都顶住了，最多再跌一天这周就不跌了？,06-06 02:41
开始反弹啦,06-06 02:41
拉尾盘拉老乡别走明天有好行情,06-06 02:40
绩优中小的春天来了,06-06 02:40
烦不烦，要就一下给跌到位。非得在那硬撑,06-06 02:40
保住3000点,06-06 02:40
收盘3050,06-06 02:40
a股我教你个方法，把所有垃圾票拉下年线，谁上来就爆谁头，剩下好票不能跌入年线下方,06-06 02:40
并入日经和纳斯达克吧，毕竟人家能涨,06-06 02:40
方向对赚钱，错亏钱,06-06 11:39
拉尾盘了，老乡别走呀,06-06 02:40
极为罕见，原因找到了,06-06 02:40
太惨了个股！！！指数风险并不大，只不过个股真的不好说的两市超4700家绿盘。每年,06-06 10:27
空仓4天了，空仓的快乐不言而喻，能吃得香，睡得着了，预感还要极速下探，等待信号再,06-06 02:40
$上证指数(SH000001)$,06-06 02:39
今天劳动节吗,06-06 02:39
无语无语了,06-06 02:39
开启去散户化了,06-06 02:39
收回3070冲[主力][加油][火箭],06-06 02:39
A股突发大跌！明天或许还有狂风暴雨？,06-05 06:49
收回3070冲[主力][加油][火箭],06-06 02:39
A股突发大跌！明天或许还有狂风暴雨？,06-05 06:49
抗住！,06-06 02:39
3000保卫战，五穷六绝[哭]跑吧,06-06 02:39
发生什么事了，又4千多股下跌。,06-06 02:39
说什么都是失望，看着别人不是新高就是在新高的路上，屏蔽了。一年后再来看看,06-06 02:39
14点半后加速下跌，今天不卖，明天取不出钱了,06-06 02:39
上周5天绿4天这周又来[哭],06-06 02:39
231家涨谁，怎么不都跌呀。跌没了算了，反正也不争气,06-06 02:39
牛市来啦,06-06 02:39
还差20点,06-06 02:39
大霄，三千能保住吗？,06-06 02:39
买海油,06-06 02:39
$上证指数(SH000001)$,06-06 02:38
幸好我的股票ST了没有跌太多,06-06 02:38
[看空][看空][看空][看空][看空][看空][看空][看空][看空],06-06 02:38
太可怕了，我的个股每天都绿油油[哭][哭][哭][哭][哭],06-06 02:38
是不是又要保卫3000点了,06-06 02:38
#专家建议暂停量化交易！股友们怎么看？#现在是市场冷清没人玩，量化占比过大，导致,06-06 02:38
2024.06.06周四点评,06-06 12:40
消户是最明智的选择,06-06 02:38
保卫战兄弟们,06-06 02:38
还暂停啥，坚绝禁止#专家建议暂停量化交易！股友们怎么看？#,06-06 12:59
6.6：周四午后，A股延续调整格局,06-06 11:50
实在不用装了,06-06 02:38
再次打响3000点保卫战,06-06 02:38
不见百点长阴不上车[大笑][大笑][大笑][大笑][大笑][卖出][卖出][卖出,06-06 02:38
双要3000保卫战了,06-06 02:38
不是暂停，是永远禁止量化#专家建议暂停量化交易！股友们怎么看？#,06-06 11:41
贝莱德说的没错吧,06-06 02:38
非理性的下跌，淡定,06-06 02:38
虽然破位但是又拉回来。,06-06 10:50
量化反复做T#专家建议暂停量化交易！股友们怎么看？#,06-06 02:37
比2660还要糟糕！,06-06 02:37
转发,06-06 02:37
又是恐慌性杀跌！,06-06 02:37
感觉好多人还在抄底[色][献花],06-06 02:37
3000点，我胡汉三又回来了。哈哈哈,06-06 02:37
哇绿哇绿的真好看,06-06 02:37
不应该是这个样子的！,06-06 02:37
很简单。大盘股涨多了急需散户接盘。当然还能涨，因为散户还在观望。撤出来空仓看戏就,06-06 02:37
三点止跌,06-06 02:37
6月份要破3000吗？,06-06 02:37
买不完，买不完，根本买不完[怒],06-06 02:37
想干嘛，不过了,06-06 02:37
看看人家，差距怎么这么大呢，,06-06 02:37
【英伟达市值超苹果！】,06-06 06:32
微盘股跌够了，就该轮到大盘蓝筹股补跌，那里来回到那里去！股票本无价值，价值是炒出,06-06 02:37
贵金属板块怎么还是红的？你怎么不变绿呀？,06-06 02:37
#专家建议暂停量化交易！股友们怎么看？#,06-06 02:37
熊市坑人啊,06-06 02:37
神奇的2点半 3000点保卫战开始啦,06-06 02:37
今天早盘被砸蒙了，割了，今天下午低了再买回来。我的参照底3061，破位一天不算破,06-06 11:33
3千点保卫战必以空军胜出,06-06 02:36
牛市来啦，耶耶耶,06-06 02:36
指数快点下去，不要高高在上!把个股害惨了,06-06 02:36
今天到现在才4700多家股票下跌！,06-06 02:36
下周将开始第61次3000点保卫战,06-06 02:36
跟昨天一样,06-06 02:36
指数差不多了吧，个股就不知道了，惨[吃瓜],06-06 02:36
就是针对2635以来的调整,06-06 02:36
究竟是哪些大SB在砸盘,06-06 02:36
涨上去难，跌下来好容易啊[大笑][大笑][大笑]太脆弱了,06-06 02:36
今天所有指标除了贵金属高举红旗，其它一片绿色草地，啥时开出鲜艳美丽的花朵啊,06-06 02:36
三千点保卫战又双叒叕近在咫尺！,06-06 02:36
#专家建议暂停量化交易！股友们怎么看？#不是暂停，是应该停掉,06-06 02:36
阿弥陀佛,06-06 02:36
比2660点还要糟糕！,06-06 02:36
这完美配合,06-06 02:36
保卫战打响，3千点,06-06 02:36
哈哈，真好，又要开始3000点保卫战了[赞][赞],06-06 02:35
今天看来玩了！人民币汇率上来了！,06-06 02:35
不论做任何事情都应三思而后行、通盘考虑，既使本意是好的，如果一意孤行，不适度而为,06-06 02:35
告诉我，老胡亏多少，我心里平衡一下,06-06 02:35
继续杀呀兄弟们上刺刀,06-06 02:35
3000点保卫又又要打响了。,06-06 02:35
黄金一刻钟，加仓买入,06-06 02:35
心态崩了,06-06 02:35
这钱怎么回来呀？股市还我钱来[哭][哭][哭][哭][哭][哭][哭][哭][哭,06-06 02:35
又要保卫3000点了,06-06 02:29
致大A一封信：,06-06 02:29
卸载软件，珍爱生命。,06-06 02:29
尾盘没机会！,06-06 02:29
哇哦过瘾,06-06 02:28
就问你还顶不顶得住,06-06 02:28
好！放量下跌！！！,06-06 02:28
这市场怎么了，缩量上涨，放量下跌,06-06 02:28
即将再见到3000点保卫战，呵呵,06-06 02:28
有脾气明天直接低开10%,06-06 02:28
开放市场，#专家建议暂停量化交易！股友们怎么看？#,06-06 02:28
哈哈，1月份都没有这么惨，不给活路,06-06 11:26
加速了吗,06-06 02:28
14点半该反弹了吧,06-06 02:28
那会好像有了反弹，结果大盘越跌越狠,06-06 02:28
国家队就喜欢出现这种情况。,06-06 02:28
三年全仓谁懂啊,06-06 02:28
昨天中信证券才说要涨今天大盘就跳给你看,06-06 02:28
国家队呢？？？？,06-06 02:28
能不能一次跌到底！[哼],06-06 02:28
大盘最高点跌下来不到5个点，我们跌了20个点,06-06 02:28
$上证指数(SH000001)$,06-06 02:28
牛，竟然还有两百多家上涨,06-06 02:28
你就说说今天多少量化在参与,06-06 02:28
这个A股何时是底,06-06 02:28
每分钟都是煎熬！,06-06 02:28
今天能否表演一个全绿盘，创个记录玩玩,06-06 02:28
这样子大盘指数不应该跌3.6，5.6吗？是不是系统出问题了？,06-06 02:28
#高息资产持续走强，中国神华年内新高#三雄极光，红蜻蜓，大秦铁路，广东明珠难道就,06-06 02:28
3000点保卫战重新打响,06-06 02:27
大盘没跌多少，个股都跌成了,06-06 02:27
一起空单干,06-06 02:27
和一月份一样了，人气萎靡，天天新低。,06-06 02:27
目标价3046如期而至,06-06 02:27
量化可以不禁止，但只能买进，#专家建议暂停量化交易！股友们怎么看？#,06-06 02:27
明天三千保卫战,06-06 02:27
牛市？中信呢？出来说说,06-06 02:27
无底线了[惊讶],06-06 02:27
以前的端午节都跳水，你们忘了吧？,06-06 02:27
量化交易纯属投机#专家建议暂停量化交易！股友们怎么看？#,06-06 02:27
3000点保卫战即将再次打响！兄弟们，你们准备好了么？,06-06 02:27
恢复态势良好,06-06 02:27
小微盘股杀疯了[大哭],06-06 02:27
2024年6月6日A股连续下跌三天今天达到4800多只股票下跌。连续三天4000,06-06 02:27
高市净率股，特别是退市股，亏损股！每股未分配利润为负数股！大熊市慢长！无市场！全,06-06 02:27
中信牛阿！[旺柴][旺柴][旺柴],06-06 02:27
跌得太少了,06-06 02:27
奔三千点去了，清仓了，等千股涨停再来,06-06 02:27
大家还不买中字头吗？不买接着揍，揍到你们来买为止！[旺柴][旺柴][旺柴][滴汗,06-06 10:56
哎,06-06 02:26
股指期货全都是空单玩命的杀跌,06-06 02:26
交易市场波涛汹涌，巨浪翻滚…,06-06 02:26
这架势要奔3000点而去了。,06-06 02:26
今天指数分时轨迹看出，融券做空和转融通以及量化共同发力，融券做空和转融通最为果断,06-06 02:26
a股，是怨不得散户不相信自己的，主要资金扛不住，指望散户去挑大梁？,06-06 02:26
公平最重要#专家建议暂停量化交易！股友们怎么看？#,06-06 02:26
得，又要3千点保卫战了,06-06 02:26
真厉害啊，先拉大票，砸小票，尾盘砸大票,06-06 02:26
空方胜！护盘队输了，明天3千点保卫战！,06-06 02:26
补量下跌,06-06 02:26
巴菲特也玩不过A股,06-06 02:26
$上证指数(SH000001)$,06-06 02:26
原因找到咯吗？[大笑],06-06 02:26
是去参加跳水比赛吗，一天要跳多少次？？？！！！,06-06 02:26
黑色星期四,06-06 02:26
股指期货空单开始砸盘了,06-06 02:26
兄弟们，今天不加仓何时加仓,06-06 02:26
跌破3050了,06-06 02:26
怎么多年还是要回到3000点。,06-06 02:26
这个已经快新低了,06-06 02:26
操,06-06 02:26
转发,06-06 02:26
好好好[赞],06-06 02:26
快收盘，不要再跌了,06-06 02:25
又开始杀了,06-06 02:25
快跑主力跑的差不多了要做空了,06-06 02:25
我擦，反弹了一点点，结果跌的更多了……,06-06 02:25
主力在大规模撤离!,06-06 02:25
放心，你希望微盘面值退市，我们散户希望大盘股变微盘跟着面值退市。[微笑],06-06 02:25
小户真有钱，全部都是小户买进,06-06 02:25
那么做小盘股真的经不起量化交易的兴风作浪！#专家建议暂停量化交易！股友们怎么看？,06-06 02:25
还得有一波基金恐慌盘卖出，还得跌。,06-06 02:25
请求停止！！！！#专家建议暂停量化交易！股友们怎么看？#,06-06 02:25
大盘真稳,06-06 02:25
有本事继续合伙拉红盘啊,06-06 02:25
大家再坚持一会，再过半小时就不跌了,06-06 02:25
啊啊啊，又到了3000点[大笑][大笑][大笑],06-06 02:25
从此以后不买股,06-06 02:25
又要杀尾盘了,06-06 02:25
说明3千点是对的,06-06 02:25
$上证指数(SH000001)$,06-06 11:45
大盘会破3000点吗？,06-06 02:25
大跌趋势开始。该来的终于还是来了。,06-06 02:25
2970？,06-06 02:25
今天有是跌麻了的一天，早盘红开还以为今天是反弹的一天，急吼吼冲进去，现在一看全部,06-06 02:25
均价大跌3、4个点指数跌1个点不到[捂脸],06-06 02:25
信心啊信心！,06-06 02:25
明天开始三千点保卫战打响了,06-06 02:24
现在都是散户在跑，主力可能在进货。,06-06 02:24
反复诱多，管住手。三千点必破,06-06 02:24
完全靠着新股越来越多的优势，才能把指数维持在这个位置，没有新股估计早就破千了[大,06-06 02:24
现在才知道，端午节安康。吃艾草。,06-06 02:24
神奇的地方就是指数不跌,06-06 02:24
我有预感明天破3000,06-06 02:24
与辉同行销售额超东方甄选,06-06 07:27
还抄底吗,06-06 02:24
4800家下跌。3200家下跌超过百分之3.大盘微跌百分之0.5.会玩。,06-06 02:24
量化不背锅#专家建议暂停量化交易！股友们怎么看？#,06-06 02:24
这位置相当于个股2600了吧,06-06 02:24
不应该啊……,06-06 02:23
要大跌了,06-06 02:23
要砸就别磨叽。,06-06 02:23
祝孩子们高考顺利，金榜题名，一举高中！,06-06 02:23
全部清零，重新开业,06-06 02:23
2867那个缺口得去补一下,06-06 02:23
又开始跳水了，就是警告散户抄底必死，没有底。,06-06 02:23
成败就在最后半小时！顶不住的话就要一泻千里了！,06-06 02:23
国家队呢，呵呵，没眼看,06-06 02:23
这下跌的爽了，持绿过节,06-06 02:23
看看量化好恶心的量化,06-06 02:23
反复拉，反复套你,06-06 02:23
我真是服了,06-06 02:23
各位，近两个月谁在这个市场挣到钱了?,06-06 02:23
年线击穿了,06-06 02:23
量化就是投机取巧#专家建议暂停量化交易！股友们怎么看？#,06-06 02:23
4600多家下跌，141家跌停[滴汗],06-06 02:22
很多票只值1000指数,06-06 02:22
#专家建议暂停量化交易！股友们怎么看？#一切量化都应该根除！,06-06 02:22
可以只留下500支股就可以了，因为掉惨了的4700多支股对大盘的涨跌没有起到多大,06-06 02:22
来来回回的杀是为了啥？杀出恐慌吗,06-06 02:22
跌破三千点再看看能否买点,06-06 02:22
砸呀，继续跌啊，我还有一万多块，二千五就加仓，不然一分都不加,06-06 02:22
坚决不接盘,06-06 02:22
主力资金加速流出一超310亿元,06-06 02:22
哎！怎么还有涨的,06-06 02:22
大伙赚钱了吗,06-06 02:22
很多散户被深套了，账户根本不会动，那么每天资金流出那么多，到底谁在卖卖卖？[滴汗,06-06 02:22
大盘3000点，股价2600点，这两个月跌的比春节前那一波还惨。。。。,06-06 02:21
天天卖不完，根本停不下来，深不见底,06-06 02:21
不管有没有量化，保护中小投资者才是根本！,06-06 02:21
跳水,06-06 02:21
收市3040~3038,06-06 02:21
北向大量外流，不敢报了,06-06 02:21
几年前很多公司就想主动退市了，现在趁机借东风全身而退，而且发转债的也可以不用还债,06-06 02:21
文化传媒板块今天到达7000附近……,06-06 02:21
今年涨了4%多，而且长期持有的感觉就是调仓策略也很给力,06-06 02:21
对大A绝望了，留在这任由宰割的命，还剩1/3仓，准备清仓了，有机会玩玩美丽国的E,06-06 02:21
机构，散户，都没信心了么？牢底坐穿怎么一个也没有呢？,06-06 02:21
某信昨天都发信号了，还不跑？,06-06 02:21
应该算推倒重新来了。新政彻底进行后，中国股市应该长期走牛，价值+成长应是大牛股,06-06 02:21
天天亏钱，生活很无趣,06-06 02:20
转发,06-06 02:20
6月5日中信证券:下半年A股将迎来年度级别上涨行情拐点。著名反向指标名不虚传啊,06-06 02:20
#专家建议暂停量化交易！股友们怎么看？#量化砸盘动作整齐化一，砸的你哭爹喊娘,06-06 02:20
大盘马上翻红，指数目前微微跌几个点。个股4400家待涨,06-06 02:20
这几天小股杀疯，小作文功不可没,06-06 02:20
砸盘的快400亿了，这是怎么了？这么多资金流出？,06-06 02:20
量化应该永久取缔！#专家建议暂停量化交易！股友们怎么看？#,06-06 02:20
没放巨量坚决不入场,06-06 12:19
所有指数不跌，个股如此惨烈。,06-06 02:19
赞成取消量化交易[微笑],06-06 02:19
报复性反弹快来了,06-06 02:19
在4000多家待上涨的严峻形势下，三大指数居然红。。。。,06-06 11:12
不会又打3000点保卫战吧？[哭],06-06 02:19
杀小买大，过几天杀大就安心了,06-06 02:18
你会相信指数收盘还是红的吗[旺柴],06-06 02:18
3050抄底明天给点吧,06-06 02:18
120日均线2950有支撑,06-06 02:18
3000点指日可待,06-06 02:18
放量了，好消息,06-06 02:18
从个股的趋势上来看一个月以后再买股票，这段时间不要动,06-05 02:31
长江电力中国神华中国移动中国海油，稳住大盘功不可没[呲牙]#高息资产持续走强，中,06-06 02:17
周四上证A股走势,06-06 05:02
跌的我已经喘不过气来了，只能说一句明天会更好,06-06 02:17
莫慌，大盘还是稳住了,06-06 02:17
看盘面，散户都割肉了[笑哭],06-06 02:17
大A尿性太差,06-06 02:17
再杀也杀不动了，没人玩了，也没人加仓，全部都躺平了,06-06 02:17
股价己很于年前2635时，差不多相当于2400~2500，可为什么现在指数是30,06-06 02:16
现在不敢买股票，就永远不要炒股票了，我不敢说今天是大盘的底，但是现在是大部分股票,06-06 02:16
赚钱的不是老鼠仓就是投机客，中国股市不能参与了,06-06 02:16
3049有资金进场，股民太难了,06-06 02:16
恐慌盘还没没出，不入,06-06 02:16
3500必到,06-06 02:16
股市的生态已经彻底的发生了变化，所有的机构和散户投资者都在迫不及待的撤退，还有人,06-06 02:16
24-6-6 周四10:51再次报到！今天大A必收盘阳线！,06-06 10:52
20月复权均线是个股中线行情重大分水岭，切记！,06-06 01:17
转发,06-06 02:15
一卖就拉我真是韭菜[哭],06-06 02:15
专家是建议暂停，首先得打赢股市保卫战。#专家建议暂停量化交易！股友们怎么看？#,06-06 02:15
雷火练真金，真正合格的上市公司应该拿出勇气来捍卫自己公司的股价！而不是任由股价一,06-06 02:14
直接取缔量化，不公平必然乱象百出#专家建议暂停量化交易！股友们怎么看？#,06-06 12:21
说红就红,06-06 02:14
真讽刺，大盘微跌，结果4000多只下跌[滴汗],06-06 02:14
#专家建议暂停量化交易！股友们怎么看？#量化就是空头，收割散户，必须关闭,06-06 02:14
还好5月份赚了很多，6月份少赚点吧，先空仓看戏几天，等市场收割一波再出手,06-05 03:12
一年数次,06-06 02:14
中国有量化，就很难有持续性行情#专家建议暂停量化交易！股友们怎么看？#,06-06 02:14
装什么装，继续砸！2850等你呢！！！,06-06 02:14
敢不敢拉红,06-06 02:14
个人观点之阶段性总结,06-06 02:14
30、60分钟底背离，此时V转，明天收红[看多][看多][看多],06-06 02:13
像极了年初[捂脸],06-06 02:13
不乱买了。。留着吧,06-06 02:13
外资看好，大盘股能上4000，一千利好[大笑][大笑][大笑][大笑][大笑][,06-06 02:13
主力天天大卖，卖公司,06-06 02:13
3000点又开始给我上一堂课，要么就坚持持有、要么退一步海阔天高，很纠结还是作出,06-06 02:13
关灯睡觉,06-06 02:13
是不是准备打响保卫战,06-06 02:13
开心过好每一天,06-06 02:13
空仓等破3000点,06-06 02:13
现在要不要割肉，看上去好危险，已经亏麻了,06-06 02:13
量化打击股市行情，市场信心不足阶段，只会助跌#专家建议暂停量化交易！股友们怎么看,06-06 02:13
做空的工具，建议关闭#专家建议暂停量化交易！股友们怎么看？#,06-06 02:13
股指阴跌，票儿大跌。股指微涨，票儿小跌！！！,06-06 02:12
不会吧，有一次3000点保卫战！！！,06-06 02:12
个股不指望上涨赚到钱了，时机过去了,06-06 02:12
三天收不上3080将走熊,06-06 02:12
煤炭电力这些公司高位，今年涨了很多，没有人接出不来，机勾们就等科技股里面的资金出,06-06 02:12
跌呀,06-06 02:12
肆无忌惮简直就是肆无忌惮,06-06 02:12
看这情况这周3000点守不住了，获利的了结先了，节后看看能不能反弹吧[捂脸],06-06 02:11
都这个时间了，还没有神秘资金入市，收盘怕是要暴跌啊,06-06 02:11
从5月6号到6月6号。沪深主力资金没有一天是流入的。都是哪些资金在跑？,06-06 02:11
这股市还能玩吗，家人们[哭][哭][哭]累了,06-06 11:37
昨天就让你们跑，离开股市，不听就拍大腿吧,06-06 02:11
[哭][龙头],06-06 02:11
散户不跑就是阴跌吗，我都空仓了还跌吗,06-06 02:11
三千点保卫战的号角即将临近,06-06 02:11
某敢死队，正在死守3000点。,06-06 02:11
谁能告诉我怎么办啊，满仓3个票2个20CM跌停。一个-5[大哭][大哭]，房子钱,06-06 02:11
管住手，只卖不买,06-06 02:11
半年了你们怎么样，还好吗,06-06 02:11
这是要把所有友军都拖下水的节奏么，人家刚投的钱，你就砸,06-06 02:11
量化只能做市值500亿以上的股票，让他们与机构搏杀，这样既保证了量化又让散户不被,06-06 02:11
量化最坏！#专家建议暂停量化交易！股友们怎么看？#,06-06 02:10
情绪性杀跌！,06-06 02:10
年内多次分红，业绩稳增长，未来建设工程上亿，成长性很好，如果股票价格能跌到11块,06-06 02:10
今天明天忍住不买，又能被动空仓三天,06-06 01:53
又是情况了,06-06 01:53
韭菜真心太可怜了。,06-06 01:53
都说不该炒垃圾股，可我买的是市盈率14，市净率0.9，上市以来从没亏损的股票，都,06-06 01:52
今天见底吗？,06-06 01:52
过节了，不开心。,06-06 01:52
上证支撑位2930点左右吧？,06-06 01:52
破三千就在不远处。,06-06 01:52
比年前还要惨几倍,06-06 01:52
美股咋会涨呢…,06-06 01:52
情绪已经冰点了明天开始大返工此情此景似曾相识,06-06 01:52
今天大盘比昨天跌得少些。,06-06 01:52
慢牛没等到慢熊来了谁扛得住啊！,06-06 01:52
反应总是慢很多,06-06 01:52
又要考验3050-3000点了吗,06-06 01:52
指数硬抗是没用的，还不如早点下去，把个股害惨了,06-06 01:52
指数在跌倒2600个胡股不得都到2块钱去,06-06 01:52
3000点保卫战准备了,06-06 01:52
下跌空间应该不大了吧，可以补仓了,06-06 01:52
干脆一口气，跌到三千点！,06-06 01:51
天天几百亿流出，见鬼了！,06-06 01:51
快抄底啊！牛来了！,06-06 01:51
之前转出了大部分，今天再把最后剩下的6万元都转出来了，亏就亏吧，不玩，这股市不是,06-06 01:51
量化真的厉害，想拉就拉，想跌就跌,06-06 01:51
必须把量化资金抓起来从严审核后面的利益链#专家建议暂停量化交易！股友们怎么看？#,06-06 01:51
3000点保卫战再次扔响[哭],06-06 01:51
现在是季线回踩的买点！！！！！！慌就对了！买错也要买！[加油][加油][加油][,06-06 01:51
3045见,06-06 01:51
三千必破,06-06 01:51
3000点保卫战又开始了,06-06 01:51
中午刷到视频，一个上海老掉牙的大爷说打到3050一定要满仓。,06-06 01:51
4928待涨,06-06 01:51
差不多得了,06-06 01:51
这也不太好吧；差不多4500家待涨[滴汗][滴汗][滴汗],06-06 01:51
今天快还剩一个账户了，加仓32000股交易利润2点7分,06-06 01:51
3071直接压到年线了[捂脸]，趋势下行中，再不出点新东西就准备3000保卫战吧,06-05 01:56
别看跌得凶，入手时机,06-06 01:51
看今天能全部绿盘不？,06-06 01:51
开启加速下跌！完美 太难熬了,06-06 01:51
个股比以往大跌60点都惨！,06-06 01:51
难道今天是提议取消量化带来的后果,06-06 01:51
$上证指数(SH000001)$,06-06 01:51
销户吧真的毫无投资价值量化玩吧,06-06 01:51
要去3043左右的,06-06 01:51
完了，跌上瘾了,06-06 01:51
量化交易对散户不公卜#专家建议暂停量化交易！股友们怎么看？#,06-06 01:51
必有一根大阴线,06-06 01:51
割条，原来是连绿九天，就看你割不割,06-06 01:51
真的快跑啊,06-06 01:51
#专家建议暂停量化交易！股友们怎么看？#那个市场没有量化，大户，散户谁不是量化。,06-06 01:50
救命呀怎么跌那么惨,06-06 01:50
了,06-06 01:50
停止量化，停止过山车行情#专家建议暂停量化交易！股友们怎么看？#,06-06 01:50
比2015年还惨！！服服的了！！再也不来了！,06-06 01:50
午间涨停一览：芯片：中晶科技、立昂微、上海贝岭、海能实业、民德电子、科翔股份+明,06-06 01:50
将再见3000点,06-06 01:50
……,06-06 01:50
怎么没人喊保卫3000点了,06-06 01:50
奔向3000,06-06 01:50
没用,06-06 01:50
大V说了！现在就是倒车接人[捂脸][捂脸][捂脸],06-06 01:50
今日目标3046,06-06 01:50
支持#专家建议暂停量化交易！股友们怎么看？#,06-06 01:50
……,06-06 01:50
今天流出350亿[吃瓜],06-06 01:50
快收盘吧，顶不住了,06-06 01:50
看指数有什么意义？？？,06-06 01:50
大盘今天下跌一个点绝对2000股跌停,06-06 01:50
空仓就是好，不赚也不亏[微笑],06-06 01:50
禁止量化从停止基金开始。#专家建议暂停量化交易！股友们怎么看？#,06-06 11:09
昨天缩量跌，今天放量跌，有进步,06-06 01:50
中国股市到底还有投资价值没得？,06-06 01:50
小散们快帮忙找原因,06-06 01:49
3000点够下半年跌了,06-06 01:49
明天3000点,06-06 01:49
#专家建议暂停量化交易！股友们怎么看？#你明牌你怎么玩？,06-06 01:49
3000点保卫战都不用打了，很迅速的,06-06 01:49
牛逼……,06-06 01:49
好好好，把本还给我,06-06 01:49
上午小亏清仓上岸，早盘搞一下转债也被打了一下手。回头看原来拉股出债。就这个盘面，,06-06 01:49
这算不算,06-06 01:46
要跑吗？怕了！,06-06 01:46
停不了根本停不了[捂脸][捂脸][捂脸],06-06 01:46
