context,date_time
好几万亿的市值利润就这么点。小盘股就不错了。,06-06 01:46
别拉权重了，砸到1600我也认了！！！！,06-06 01:46
太特么吓人了,06-06 01:46
不是我吹像我一样你们有几个能做到，举手我看看谁做到了,06-06 01:46
再玩2天百股跌停,06-06 01:45
。,06-06 01:45
这韭菜割的。厉害啊。,06-06 01:45
抄底,06-06 01:45
小场面[捂脸][捂脸][捂脸],06-06 01:45
绝了,06-06 01:45
跌的真历害,06-06 01:45
涨空拉指数，跌个股杀，你想回本，就等着把裤衩留下,06-06 01:45
是真相?还是巧合?荣科科技再次发布公高管变动公告。关键问题是最近高管变动为什么那么频繁?有何玄机?,06-06 08:45
……,06-06 01:45
我！,06-06 01:45
赶紧跑啊,06-06 01:45
$上证指数(SH000001)$,06-06 01:45
过节就亏，今天又跌停板了，坑死人了,06-06 01:45
只要不卖就不算亏[怒],06-06 01:45
又要3000点保卫战啦！,06-06 01:45
指数没跌多少个股跌疯了[惊讶][惊讶][惊讶],06-06 01:45
威武,06-06 01:45
快,06-06 01:45
这两三年还看不明白吗？,06-06 01:45
主力资金是不计成本，争先恐后的跑,06-06 01:45
$上证指数(SH000001)$,06-06 01:45
2.0,06-06 01:45
最后的钱了，已经绝望了，兄弟们，我先走一步[哭],06-06 01:44
666#专家建议暂停量化交易！股友们怎么看？#,06-06 01:44
年年三千点。年年至少几次三千点保卫战,06-06 01:44
厉害,06-06 01:44
黄线三个多点了,06-06 01:44
加把油！突破5000家待账马上实现了,06-06 01:44
指数在3000看下个股80%都在1800哈哈,06-06 01:44
技术型调整,06-06 01:44
老胡，出来走两步。,06-06 01:44
新低新低又新低,06-06 01:44
6,06-06 01:44
兄弟们，我已经闻到了淡淡的小牛味,06-06 01:44
跌穿3000,06-06 01:44
看图,06-06 01:44
跑吧，不然亏的渣都不剩,06-06 01:44
3000点保卫战又拉响了,06-06 01:44
要是能做空就好了[奸笑][奸笑],06-06 01:44
好好好，非常棒，,06-06 01:44
这大盘太搞笑了,06-06 01:44
是谁在做空小盘股,06-06 01:43
看看微盘股跌的连他马都不认识了,06-06 01:43
大概率2986,06-06 01:43
这个比例！它至少敢红,06-06 11:33
明天应该要破3000点了,06-06 01:43
要想炒底等破了3000点,06-06 01:43
[晕],06-06 01:43
惨不忍睹,06-06 01:43
又跳水了[捂脸],06-06 01:43
从来没有过什么牛市，一直在跌[成交][成交][成交][看空],06-06 01:43
加油，争取500家下跌,06-06 01:43
白线是实际指数，黄线是股票均价指数。也就是说小盘股现在的均价跌倒2950以下了都,06-06 01:43
微盘股又一次陷入非理性背离基本面的大幅下跌中，仍无止跌迹象，,06-06 12:51
大盘微跌一点点，牛逼,06-06 01:43
别管，准他畅畅快快的跌几天,06-06 01:43
今天还有销户的吗？,06-06 01:43
快跑快跑快跑快跑快跑快跑快跑快跑快跑快跑快跑快跑快跑快跑快跑快跑快跑快跑快跑快跑,06-06 01:43
暴跌暴跌再暴一点！,06-06 01:43
出点政策救救光伏吧,06-06 01:43
刮骨疗伤，嗯又见3000点，刮来刮去还是3000点,06-06 01:43
取消量化的唯一途径是可以做多也可以做空#专家建议暂停量化交易！股友们怎么看？#,06-06 01:43
投资高息也得看估价，现在都高啦，暂时不考虑#高息资产持续走强，中国神华年内新高#,06-06 01:42
今天百股跌停，明天千股,06-06 01:42
这是怎么做到的指数不变小票几乎跌停[捂脸],06-06 01:42
等吧，我们年轻，等得到那一天,06-06 01:42
个股已经在2600了,06-06 01:42
#专家建议暂停量化交易！股友们怎么看？#赶紧取消，量化要的只是差价，做多还需要成,06-06 01:42
不能这样,06-06 11:32
不创前高见新低，趋势向下不可期。静观其便勿杂念，三千守住再来见！,06-06 01:42
跌,06-06 01:42
明天千万学子的高考，但凡倒在黎明前的基本都是意志力薄弱和赌性肥大的人，举一反三的,06-06 01:42
不创前高见新低，趋势向下不可期。静观其便勿杂念，三千守住再来见！,06-06 01:42
跌,06-06 01:42
明天千万学子的高考，但凡倒在黎明前的基本都是意志力薄弱和赌性肥大的人，举一反三的,06-06 01:42
谁来告诉我，我该怎么办？我的微盘股跌得一塌糊涂！,06-06 01:42
要奔2900点了,06-06 01:42
指数还在3050，个股2500了吧！,06-06 01:42
个股2500了,06-06 01:42
今年有世界杯,06-06 01:42
救命呀#专家建议暂停量化交易！股友们怎么看？#,06-06 01:42
眼看手勿动！,06-06 01:42
3050的支撑位基本上到位了，将会迎来小幅反抽,06-06 01:42
大部分人板块指数已经逼近年前了。,06-06 01:42
都没价值[大笑],06-06 01:42
隔三差五来个百股跌停[笑哭],06-06 01:42
收盘上不了3070点会是什么后果呢？明天收盘上不了3073点又会发生什么呢？,06-06 01:42
才135离500还远呢,06-06 01:42
量化必须取#专家建议暂停量化交易！股友们怎么看？#,06-06 01:42
未上市的公司股份值一百万，上市后变三千万，谁不卖出就是不正常。,06-06 01:42
到2850再买,06-06 01:42
比年前更惨,06-06 01:42
能不能大盘连续跌停，留下大家的祝福，目前是牛市高位，大家千万不要忘了。,06-06 01:41
3050千万别破啊大哥,06-06 01:41
买在2700套在3100，感觉我这种小散进来就是送钱的,06-06 01:41
必须取缔#专家建议暂停量化交易！股友们怎么看？#,06-06 01:41
降息了，可A股高开低走了,06-06 01:41
这个月已经好多天，指数微跌，个股三四千下跌了[想一下][想一下]全是在杀百亿一下,06-06 01:41
天天绿[愉快][愉快][愉快],06-06 01:41
不可以投资,06-06 01:41
3000点保卫战又又又....开始了[勾引][勾引][勾引],06-06 01:41
国家队不来救么[囧][囧][囧][囧][囧],06-06 01:41
#专家建议暂停量化交易！股友们怎么看？#元祖股份这只就是典型的量化炒盘，不停的打,06-06 01:41
心中有股，手中无股[吃瓜],06-06 01:41
必须停止量化，停止转融通，停止股指期货#专家建议暂停量化交易！股友们怎么看？#,06-06 01:41
知道你们现在很慌，但是先不要慌,06-06 01:41
没有救世主，都是来抄底赚钱的,06-06 01:41
远离股市，生活如意,06-06 01:41
突发一念头，50%上市公司股价低于或等于净资产会出现吗？,06-06 01:41
坚决要求取缔量化交易#专家建议暂停量化交易！股友们怎么看？#,06-06 01:41
别跌了，再跌下去真有T楼的了！！！,06-06 01:41
唉，是跌出来了,06-06 01:40
牛！跳水，,06-06 01:40
清醒点吧，家里有老有小呢[微笑],06-06 01:40
都是量化，这三指咋走的这么像，涨跌都一样，真坑。,06-06 01:40
2900保卫战又打响了,06-06 01:40
真牛比,06-06 01:40
反正买的都查不到跌停了，指数也来个大调整多好啊,06-06 01:40
中信昨天不是唱多，怎么比二月还黑,06-06 01:40
#专家建议暂停量化交易！股友们怎么看？#这只就是典型的量化炒盘，不停的打压股价人,06-06 01:40
散户看不到陆家嘴开幕了[哭][哭][哭],06-06 01:40
继续空仓。手痒买点就跌,06-06 01:40
调整到位，该涨了,06-06 01:40
这还玩个屁啊，这个市场,06-06 01:40
请问到底发生了什么事？？,06-06 01:40
连个反弹都没有,06-06 01:40
小盘股比年前那一波还厉害,06-06 01:40
3000保卫战开始,06-06 01:40
个股太惨了,06-06 01:40
保卫战筹拍中,06-06 01:39
这行情拉稀,06-06 01:39
就是砸就是干哈哈哈哈,06-06 01:39
《6月6日午盘评测》,06-06 12:38
……,06-06 01:39
2600我都是满仓的，吓唬谁呢,06-06 01:39
符合目前现状，只做抗风险公司,06-06 01:39
现在的人发言艺术真6:这几天看帖子，都是大盘向好，4000+股票待涨……,06-06 01:39
这三天大盘才跌几十个点，我的股票跌成狗，股票位置都在2700点[哭],06-06 01:39
春节前小微大跌行情又出现了，不让散户活了啊。,06-06 01:39
还能不能完了，量化,06-06 01:39
还早呢！不整爆仓是不会回头的,06-06 01:39
黎明前的黑暗,06-06 01:39
救命啊！！！！,06-06 01:38
3050开始反弹,06-06 01:38
中信证券最新发声A股下半年将迎来年度级别上涨行情的起点,06-06 01:38
交银指数星球的抗跌性让我印象深刻,06-06 01:38
你们还没有看出来吗？大部分的个股以跌到年前价了啊。,06-06 01:38
请出来，你搞得什么,06-06 01:38
天天4千家下跌，没得玩啊[哭][哭][哭],06-06 01:38
百分之八十的股票在下跌大盘还会红起来，真TM人间奇迹！[大笑][大笑][大笑],06-06 01:38
今天大盘没跌多少个股跌的真多4个多点,06-06 01:38
看大盘风平浪静，一片祥和。,06-06 01:38
这时候跑就对了,06-06 01:38
现在来看1月份的下跌只是开胃菜，这次下跌才是正席[俏皮][憨笑][憨笑],06-06 01:38
比还惨[大哭][大哭][大哭],06-06 01:38
让你一次跌个够,06-06 01:38
银行一护盘说明要完蛋了,06-06 01:38
别急，别恐慌，今天会v起来的。,06-06 10:09
见鬼，今天有三千股要跌五个点以上,06-06 01:38
股市的意义是什么？,06-06 01:37
#欧美股市大涨，A股今天怎么走？##专家建议暂停量化交易！股友们怎么看？#无语,06-06 01:37
割肉离开这个地方吧！阿弥陀佛！,06-06 01:37
今天多少跌停股？大神们报个数呗,06-06 01:37
谁相信，谁支持，谁被套，亲身体会！,06-06 01:37
不要玩了，这个月风险都很大,06-06 01:37
因受上午3077.67重砸，下午3053.75理所当然受虐~~哈哈哈,06-06 01:37
有没有00后，你们还炒股吗？,06-06 01:37
$上证指数(SH000001)$,06-06 01:37
逃命吧，兄弟们,06-06 01:37
三千毕破快跑吧,06-06 01:37
真牛逼,06-06 01:37
又被外资抄底了,06-06 09:44
今天到底，明天强拉，高考加油,06-06 01:37
快去请如来佛祖,06-06 01:36
没救了，今天注定要往死里跌,06-06 01:36
下周一限售解禁大礼包来袭,06-06 01:36
资金不从中特估出来，个股死路一条,06-06 01:36
……,06-06 01:36
这是怎么了嘛，指数没怎么跌，个股天天跌出翔,06-06 01:36
今早高开没走、现在清仓不玩了,06-06 01:36
大盘指数看似才跌0.24％，可平均股价已经下跌了2.87％。,06-06 01:36
停量化停转融通#专家建议暂停量化交易！股友们怎么看？#,06-06 01:36
目前情况，只看不动！,06-05 09:23
这周都跌了多少点，没有比惨的吗,06-06 01:36
黑周四44,06-06 01:36
今日目标，2999点,06-06 01:36
最近每次下跌都是放量,06-06 01:36
三千点见,06-06 01:36
通过做空北证50，带动整个中小盘往下，这种玩法高啊。,06-06 01:36
都跌穿了指数居然没动,06-06 01:36
猛跌才能把散户套住，涨一下大家都跑了[赞][赞],06-06 01:35
个股早都跌破2500了,06-06 01:35
是怎么做到的？指数不跌，个股跌4700多家，难道这就是传说？,06-06 01:35
很好，我天天所有股票都绿，现在这么玩是吧？以后谁再问我股市，我只会告诉他远离！,06-06 01:35
跟中国海油石油走势相反，可以看看分时图,06-06 01:35
上午盘受到10“47~10”51两次重锤，明儿日子也过不好了~~~哈哈哈,06-06 01:35
好好好,06-06 01:35
地,06-06 01:35
唉，天天是[哭][哭][哭][哭]。,06-06 01:35
近期有望坐上主升浪的五朵金花，建议收藏！1、新余国K现价：26.47元，总市值：,06-06 01:30
今天暴跌，明天拉回，就和网站搞促销一样。无语了,06-06 01:35
端午来了,06-06 01:35
天气预报～～～～～,06-06 01:34
这次会破3000吗？,06-06 01:34
这个月买了3个票，崩了3个票，我都怀疑自己了,06-06 01:34
成交量起不来，行情就不会好，大家多看少动吧。2024.6.6#专家建议暂停量化交,06-06 01:34
要回3014？！,06-06 01:34
指数跌吧跌，跌100点,06-06 01:34
不坚持了！转看空！,06-06 01:34
应该有很多大股东借券变现了，不可能全是散户在天天卖,06-06 01:34
真疯了，猛杀微盘股,06-06 01:33
这指数根本不准,06-06 01:33
又开始了,06-06 01:33
放量才能来,06-06 01:33
风险大于收益,06-06 01:33
天天在中间线来回穿梭[笑哭],06-06 01:33
快点收盘吧,06-06 01:33
指数没变化，个股跌出翔,06-06 01:33
只出不进的资金，怎么跳过这思维,06-06 01:33
周线MACD马上死叉，能空仓都空仓吧，一两天的反弹不要也罢，估计还有一波大的下跌,06-06 01:33
又见！,06-06 01:33
量化在跑？,06-06 01:33
今天是恐慌性下跌及风险释放，也是场外资金进场的机会，所以我赌尾盘必然上拉。,06-06 01:33
跌到3000点可以把房子卖了孤注一掷发财,06-06 01:33
上不去，你就痛快点下来吧。,06-06 01:33
没有人玩了。只融资的股市终究是玩不转的。,06-06 01:33
天天式的护盘,06-06 01:32
在也不见了[哭],06-06 01:32
$上证指数(SH000001)$,06-06 01:32
想多少点就多少点，动动键盘的事,06-06 01:32
加仓,06-06 01:32
想多少点就多少点，动动键盘的事,06-06 01:32
加仓,06-06 01:32
空狗不死大盘不起,06-06 01:32
现在就问这股市要怎么买才行，长线跌下去涨不回来，短线涨上去就割韭菜，好玩什么,06-06 01:32
全球股市都涨，除了A股,06-06 01:32
白线和黄线差了3%,06-06 01:32
2973,06-06 01:32
这走势不可能有大的反弹,06-06 01:31
明天会更好,06-06 01:31
销户才是正确的选择,06-06 01:31
使劲砸，看谁扛不住,06-06 01:31
无底线,06-06 01:31
个股都跌成什么样子了？,06-06 01:31
最好空仓，实在手痒模拟盘操作,06-06 01:31
每天这么多下跌，大盘是如何稳住的？,06-06 01:31
2888附近等着吧！,06-06 01:31
要么大盘股拉涨停这样至少可以让小盘股喘口气！,06-06 01:30
500只红撑大盘[捂脸],06-06 01:30
炒股好丢人,06-06 01:30
看公告：小幅下跌。也太幽默了,06-06 01:30
……,06-06 01:30
请问量化交易是投资还是投机#专家建议暂停量化交易！股友们怎么看？#,06-06 01:30
。#专家建议暂停量化交易！股友们怎么看？#,06-06 01:30
那么微股咋产生的？#高息资产持续走强，中国神华股价新高#,06-06 01:30
收盘，大盘还是红的,06-06 01:30
跌到3000点可以赌一下,06-06 01:29
指数就是不跌。只跌个股,06-06 01:29
清仓观望，长年空仓，保住资金！,06-06 01:29
把钱还给我，我在也不买股票了，我错了，把钱还给我,06-06 01:29
这行情真是让人寒心啊,06-06 01:29
能量拉满,06-06 01:29
告诉大家个好消息，虽然下跌四五千家，但是指数指跌了0.0几！,06-06 01:29
尾盘股的机会来了,06-06 01:29
[哭],06-06 01:29
今天绿盘的股都没必要留了,06-06 01:29
先赔车，再赔房，剩俩钢镚吃馒头，早日收手吧，诸位，回头是岸。,06-06 01:29
大盘没怎么跌，个股稀里哗啦,06-06 01:29
最后的战士,06-06 01:29
A股这样走三千点必破,06-06 01:29
$上证指数(SH000001)$,06-06 01:29
真有意思，这个盘维的很稳,06-06 01:28
中午1500家跌超五点,06-06 01:28
全部下跌,06-06 01:28
怎么啦宝贝？,06-06 01:28
果然是今天更低,06-06 01:28
圆弧顶下跌趋势来了，快跑,06-06 01:28
进一个死一个,06-06 01:28
我的钱还我，不玩了可以吗？,06-06 01:28
……,06-06 01:28
玩不过就走,06-06 01:28
根本买不完哈哈哈哈,06-06 01:28
了，大家快跑,06-06 01:28
现在股市就在去散户把大量都割了,06-06 01:28
重仓四万股，以为回本遥遥无期，没想到早上冲高回本，因为自己贪心，没跑，结果又被套,06-06 01:28
三千点保卫战打响,06-06 01:28
跑了2个月了真厉害，内资,06-06 01:28
祝你端午节快乐,06-06 01:27
内资今年以来保守估计流出2万个小目标,06-06 01:27
指数居然不跌,06-06 01:27
跌了两个星期了,06-06 01:27
没有跌啊,06-06 01:27
#高息资产持续走强，中国神华股价新高#,06-06 01:27
今天能站住3050吗？,06-06 01:27
立刻暂停量化交易#专家建议暂停量化交易！股友们怎么看？#,06-06 01:27
加完仓了，睡觉,06-06 01:27
年前的恐惧又回来了,06-06 01:27
这种大盘，资金没有流入，只是流出能不让人害怕？,06-06 01:27
散户大多在小盘股上，所以又被玩了,06-06 01:27
2400是今年的低点接下来将模仿2023年5月后的走势,06-06 01:27
大盘没有跌啊,06-06 01:27
个股跌的不成样了,06-06 01:26
好，就该这样，都买神华不就完了，活该你们亏钱，哈哈哈，像我买神华，不就赚钱了吗？,06-06 01:26
泥沙俱下,06-06 01:26
坚信年底破2500,06-06 01:26
跌吧跌吧,06-06 01:26
大盘跌几点，各股跌几点，玩不起了,06-06 01:26
量化是下跌真正的原因，希望尽停止吧，让股民回点血呀！,06-06 01:26
$上证指数(SH000001)$,06-06 01:26
内资主力每天跑两三百亿，有牛市才怪了。,06-06 01:26
这么低的点位，这么低的估值，居然还要天天3000点保卫战！,06-06 01:21
不敢相信。。。。指数只跌了0.1个点,06-06 01:21
随时随地踩雷,06-06 01:21
4600多家呆涨[大笑],06-06 01:20
保险证券，白酒都跌成狗，这个涨跌幅你说大盘跌2个点都比较真实，为啥只显示微跌，这,06-06 01:20
进场，赚了就跑！,06-06 01:20
只要散户买入超大庄就大量卖出让散户接盘,06-06 01:20
怎么啦？,06-06 01:20
眼看着股票下跌，没有一点办法,06-06 01:20
大家都觉得6.19会有大利好，那你说大盘会涨还是跌,06-06 01:20
大盘辛亏稳住了，要不个股跌停又上千家了,06-06 01:20
2600点,06-06 01:20
这市场，买一百只股票都不一定能有一只红的,06-06 01:20
我真服了，期货大赚，A股大亏[哭]能不能不这样,06-06 01:20
不敢买了，好害怕啊,06-06 01:20
小微盘那么垃圾，大盘股那么优秀，你们可倒是买啊，这成交量一天比一天水，继续吹,06-06 01:20
砸微盘股啊！用力砸！！,06-06 01:20
上次3050的钱还没回本，现在又来下杀！食GS,06-06 01:20
快了快了，再有七八十个点就差不多了,06-06 01:20
好多股票砸到比年前的低位还要更低了，准备好现金等有反转苗头抄底,06-06 01:20
随意做空,06-06 01:19
今天算什么，放量下跌还是放量滞涨？,06-06 01:19
今天大奇迹日，下午会往下一跌以后爆拉,06-06 01:19
跌成狗,06-06 01:19
刘老师说的对，量化就是靠AI机器操控，没有长远战略利益考虑，没有环境考虑，就是做,06-06 01:19
指数下跌不多，个股方面那就惨了。,06-06 01:19
神马情况,06-06 01:19
今天很关键，相信中信证券！,06-06 07:42
开始跳水了,06-06 01:19
不要怕使劲往上吃,06-06 01:19
不要说彻底回本，回一半我都不玩了，太狠了,06-06 01:19
快逃命[卖出][卖出][卖出][卖出],06-06 01:18
又是五千家待涨！,06-06 01:18
目前股市不看业绩不看概念，只看市值，市值越大越牛逼[看空][看空][看空],06-06 01:18
[哭][哭][哭][哭][哭],06-06 01:18
$上证指数(SH000001)$,06-06 01:18
个股跌那么多，你为什跌这麽点，大盘最起码跌4个点才符合啊,06-06 01:18
好消息，指数没跌什么，坏消息个股已经跌停,06-06 01:18
牛市离不开小盘股！！！清除垃圾股误伤了众多小盘股！！！,06-06 01:18
新股发,06-06 01:18
迎接黑周五，,06-06 01:17
这次回调，3000点，应该能保住吧,06-06 01:17
纳闷，全场还有红的,06-06 01:17
五千多股，只有六百多红盘，大盘指数微微微绿，真邪门,06-06 01:17
100点左右的回调，跌去了我400点的市值，难受啊,06-06 01:17
有量化在，敢追套谁。,06-06 01:17
比2700的时候亏的还多。,06-06 01:17
股份缩并：是众多股票改变因跌破面值而被迫退市命运的关键一招！,06-04 08:09
指数3000点钱没了。,06-06 01:17
白线真厉害顽强！[大笑],06-06 01:17
主力资金天天做空，卖不完根本卖不完,06-06 01:17
这次小盘股跌下来真的回不去了，崩溃。满仓工商银行...,06-06 01:17
这样持续发展，散户会慢慢消失！,06-06 01:17
太惨了,06-06 01:17
大A威武,06-06 01:17
好好好，现在连高科技，低空经济都成了劣质资产，夕阳产业全部是香饽饽了？突出一个拉,06-06 01:17
快跑吧明天看3000点,06-06 01:17
拉上去立马砸拉上去立马砸这是杠上了不过参考以前的经验但凡当天拉起来就砸拉起来就砸,06-06 01:17
下午[上涨][上涨],06-06 01:16
“认识你自己”，它如一盏明灯，穿越时空的尘埃，照亮后人探寻自我真谛的道路。若想从,06-01 03:18
上午感觉市场情绪挺极端的，技术上上午是不可以买的，因为今天大盘属于放量下跌。A股,06-06 12:06
现在知道关键时刻他们会保什么抛弃什么了吧？,06-06 01:16
继续跌呗，还能怎么看#欧美股市大涨，A股今天怎么走？#,06-06 01:16
指数没跌，但是大部分票比2600点的时候还低，离谱！！,06-06 01:16
#专家建议暂停量化交易！股友们怎么看？#支持,06-06 01:16
瞎，看不到吗?整个市场只有一个赚钱的机会，加入做空。,06-06 01:16
家人们，这算不算啊？,06-06 01:16
$上证指数(SH000001)$,06-06 01:16
恐慌,06-05 07:52
#专家建议暂停量化交易！股友们怎么看？#被量化害的太惨了,06-06 11:17
要跳水了,06-06 01:15
中信还特么说下半年大涨，,06-06 01:15
了不起呀，太牛了了[凄凉],06-06 01:15
抄底中公！！！！,06-06 01:15
今天必跳水,06-06 01:15
指数稳如，个股跌成,06-06 01:15
天然气，能源股应该可以买了,06-06 01:15
#专家建议暂停量化交易！股友们怎么看？#专家说卖房子卖地抄底。,06-06 01:15
拉一点，继续出货，在拉，在出货，继续新低,06-06 01:15
如在跌到2600，个股会怎样,06-06 01:15
指数全红，个股惨不忍睹,06-06 01:09
大盘红的，个股惨不忍睹，做个人吧做个好人吧，[大笑][大笑][大笑],06-06 01:09
七百只股都能拉红[赞],06-06 01:08
近期出低点,06-05 06:33
这个时候如果还有人割肉卖股票的话，很可能会犯大错。,06-06 01:08
又是技术性牛市,06-06 01:08
$上证指数(SH000001)$,06-06 01:08
大盘涨这么多，你们都赚钱了吧,06-06 01:08
量化天天砸盘,06-06 01:08
起飞了,06-06 01:08
出台任何政策，都是要维护股市的健康发展。这点，十分重要！！！,06-06 01:07
黄线跌2.73%，算吗？,06-06 01:07
七百多家上涨。5干多只股票。大盘还是红的。奇怪不奇怪。,06-06 01:07
翻红了牛逼啊,06-06 01:07
调整尾声 积极介入-0603,06-03 10:32
都走吧，让挣钱的玩去,06-06 01:07
我没眼花吧，指数竟然是红的，怎么做到的？,06-06 01:07
大盘你自己玩去,06-06 01:07
叉口这么大,06-06 01:07
才4500家待涨有点不给力啊。能不能砸五百个啊[呲牙],06-06 01:07
终于下定决心销户了，从盈利几十万到亏损几十万，我认了，多么痛的领悟[哭][哭][,06-06 01:07
今日走势与昨日分析完全一致！再次探底，前面说过目前位置不是反转点，60分钟虽有见,06-05 03:40
这辈子都，,06-06 01:07
量化对于我等散户就是灾难#专家建议暂停量化交易！股友们怎么看？#,06-06 01:07
这个市场群魔乱舞，根本没法看。,06-06 01:06
今天自选股都是绿油油的很长，大盘指数才跌一点，怎么回事？,06-06 01:06
A股震荡止跌迹象，机会？不等了，加仓，今天先冲,06-04 01:33
红的离谱了,06-06 01:06
大盘又红了,06-06 01:06
资金调仓买入了业绩支撑的国央企，这是大方向，以后退市的会很多，所以抱团发展z,06-06 01:06
大盘3千点，个股2500！大A牛B,06-06 01:06
爆亏的一天,06-06 01:06
大盘红的都有4600多家待涨，不敢想象这是什么操作,06-06 01:06
别开盘了要不还得跌,06-06 01:06
【媒体：上市公司不能“一退了之”背后是数百万投资者的“哀嚎声”应将中小股东保护措,06-05 03:31
？？？,06-06 01:05
诱多走势,06-06 01:05
买买买，过节爆起来,06-06 01:05
有没有比我更加惨的，-80%了[哭][哭]，07年入市[怒][怒],06-06 11:05
公平才能引进更多的投资者，才能引进更多的资金，本来机构就有信息优势，资金优势等不,06-06 11:37
每天超过4500家下跌，牛[赞][赞][赞][赞],06-06 01:05
同志们，指数不怎么跌，每不几千只股票跌啥情况。望专家解惑。,06-06 01:05
抄底,06-06 01:05
感谢，今天建了半仓,06-06 01:05
三千点明天就到了，我的股到2300了,06-06 01:05
这么牛逼,06-06 01:05
走了，这一辈子远离股市。,06-06 01:05
牛不牛，继续寻底，哈哈哈，红盘太多了，力度不够，加油,06-06 11:22
已经没意思了,06-06 01:04
现在比2600点时还惨[哭],06-06 01:04
没法玩了,06-06 01:04
照这走势，如果上证指数再次回到去年腊月的低点，那么，将有90%的个股在现有的基础,06-06 01:04
今天必须红盘报收，别问为啥，问就是好面子,06-06 01:04
黄线-2了，我去,06-06 01:04
今天跌的太猛了,06-06 01:04
$上证指数(SH000001)$,06-06 01:04
今年创业亏，炒股亏[好困惑]现在每晚都睡不好了[大哭],06-06 01:04
圾,06-06 01:04
拉银行股了,06-06 01:03
又回到春节前的跌法了吗？,06-06 01:03
这样的下去必定会破3000,06-06 01:03
趁着空仓能不能一步砸到位,06-06 01:03
以前是指数跌，个股也跌，现在给你变了，我稳着指数，让大部分个股跌，最起码外表是好,06-06 01:03
买，快点买，全是加速下跌,06-06 09:58
今天抢反弹的会被深埋，因为3050不是底，只是A浪下跌的一个小支撑，连下跌A浪的,06-06 10:42
