context,date_time
我投降能不能把本金还给我，我保证不在玩,06-24 03:01
散户都让你们玩死了，看你们以后怎么玩,06-24 03:01
看样子2900很快就破了，接着就是破2800，然后呢，企稳，慢慢磨,06-24 03:01
七月的市场发展,06-24 03:01
$上证指数(SH000001)$,06-24 03:01
止跌了[惨!关灯吃面][惨!关灯吃面],06-24 03:01
补周线缺口去了,06-24 03:01
大家2600见,06-24 03:01
明日2958点开盘！,06-24 03:01
终于不跌了,06-24 03:01
明天破2950会跌到2944,06-24 03:01
短期无底,06-24 03:01
量化交易加股指期货真会玩啊,06-24 02:45
高光时刻：今天300家红盘，6000家待涨[鼓掌][鼓掌][鼓掌],06-24 03:01
周线6连跌，上次出现同样情况是什么时候？,06-24 03:01
看看现在这社会，能不能把我资产清零,06-24 03:01
，6666,06-24 03:01
我居然是空仓,06-24 03:01
终于止跌了,06-24 03:00
终于止跌了,06-24 03:00
真惨[惊吓],06-24 03:00
终于不跌了,06-24 03:00
6800亿，3000点不保卫了，一泻千里,06-24 03:00
如果抛开3桶油和5大行的指数涨幅，现在的指数可能在2200了。,06-24 03:00
清仓出局，刚进来没几天，就亏6千，花钱买个教训。,06-24 03:00
好好好，没有大跌哪来的大涨，慢慢来不着急,06-24 03:00
投资需要长线，运气好的一般都能到三板交易,06-24 03:00
怒涨300家哈哈哈哈哈,06-24 03:00
大A会大跌#IPO受理、上会全部恢复，如何解读？#,06-24 03:00
A股有5000多家个股，今天下跌有5000家。[大哭][大哭],06-24 03:00
的市场做出的事，,06-24 03:00
真的有点害怕了，接下来怎么办,06-24 03:00
哀鸿遍野,06-24 03:00
玩不下去了，丫们不按长理出牌还怎么玩下去，明天清仓！#IPO受理、上会全部恢复，,06-24 03:00
2500点#IPO受理、上会全部恢复，如何解读？#,06-24 03:00
这种行情，以前被套了还能等，现在不走，等待的就是退市,06-24 03:00
这故事到底怎么了？,06-24 03:00
#IPO受理、上会全部恢复，如何解读？#牛企上市牛市来了。快买快抄底。,06-24 03:00
呼叫大侠,06-24 02:59
破前低就10来个点而已，加油,06-24 02:59
人心散了,06-24 02:59
请大家充满信心，今天是最差的一天,06-24 02:59
大盘股涨有毛用？,06-24 02:59
有时候明知道会回落2960还是补完子弹[捂脸],06-24 02:59
拉几#IPO受理、上会全部恢复，如何解读？#,06-24 02:59
兄弟们我清仓了真扛不住了好了现在又少了我一个小多头,06-24 02:59
2960就是起动点！大家信吗！,06-24 02:59
跌成这鸟样还是在那些权重没咋跌的情况下，可想而知其他的票是啥样了吧[微笑],06-24 02:59
这行情还有3000亿成交，上午还1000多下午谁加仓了？,06-24 02:59
买在2600套在3000点，这不是梦，是现实,06-24 02:59
两市主力净流出422.370亿元,06-24 02:59
天天惨不忍睹[哭],06-24 02:59
大盘离前低2635还得有几天的时间。,06-24 02:59
已经销户,06-24 02:59
这是第七周阴线了,06-24 02:59
讨论个毛线。你们能咋的#IPO受理、上会全部恢复，如何解读？#,06-24 02:58
本主进入兴奋状态区间，继续等待。。。人们恐惧，我兴奋。。。。。。慌个球。。。,06-24 10:55
做空的大财团、大机构、大股东赚麻了啊！,06-24 02:58
还有两分钟就止跌了,06-24 02:58
抄底的一波韭菜 又要割了,06-24 02:58
牛市将至,06-24 02:58
$上证指数(SH000001)$,06-24 02:58
干脆全绿算了，留那么点点儿红，不如全绿,06-24 02:58
没有老乡了，没有9菜了，主力只能挖9菜根了！！根都留不住了,06-24 02:58
相信高盛的判断2500点[卖出][卖出][卖出][卖出][卖出][卖出],06-24 02:58
股市,06-24 02:58
5000家待涨，好样的,06-24 02:58
，仅5000家待涨[憨笑],06-24 02:58
长期趋势看涨～很长很长～[想一下][想一下][想一下][想一下][想一下],06-24 02:58
大家不要慌，2700点会止泻,06-24 02:58
加快速度吧，要跌就尽快到位,06-24 02:58
销户销户销户销户销户销户销户销户销户销户销户销户销户销户#IPO受理、上会全部恢,06-24 02:58
大盘下跌趋势是否要回补2867左右的缺口？,06-24 02:58
2800保卫战打响了,06-24 02:57
惨，惨，惨，无语论。,06-24 02:57
？,06-24 02:57
5000待涨，内犬跑了400多亿，积重难返，销户了。,06-24 02:57
利空股民！#IPO受理、上会全部恢复，如何解读？#,06-24 02:57
空方大胜,06-24 02:57
清仓三周，我很庆幸。哈哈哈,06-24 02:57
麻了…[怒][怒][怒],06-24 02:46
三天亏了15%,06-24 02:46
都在等出手,06-24 02:46
优秀[大笑][大笑][赞],06-24 02:46
天天主力资金净流出,06-24 02:27
黄线己经破2900……止不住，根本止不住。,06-24 02:46
季线级别的下跌，谁买套谁。,06-24 02:46
$上证指数(SH000001)$,06-24 02:46
走了，买了个教训,06-24 02:46
这是要埋人的节奏,06-24 02:45
我感觉机会进来了，明天看吧,06-24 02:45
真的是绝望期，五穷六绝七翻身，继续熬吧，选好方向等翻身,06-24 02:20
2600不远了,06-24 02:45
这波要破2890才能反弹,06-24 02:45
最佳救市办法国家队无论是拉大票还是买etf救市效果都不行因为买的etf很快被借出,06-24 02:45
111,06-24 02:22
开始了？,06-24 02:45
不炒股，我的生活很幸福,06-24 02:45
前面打开公平竞争：（买涨跌）只有涨才能赚钱不公平！只有放宽交易才是王道[买入][,06-24 12:25
各股早已跌破2630了，还掩饰什么了,06-24 12:24
15分钟,06-24 02:45
谁抄底埋谁,06-24 02:45
……,06-24 02:45
等着完蛋吧#IPO受理、上会全部恢复，如何解读？#,06-24 02:45
再这样跌下去会出人命的！,06-24 02:45
2500点见,06-24 02:45
加油做空加油做空加油做空,06-24 02:45
下跌的原因找到了吗？来个专家bb一下,06-24 02:44
希望早点大跌，不大跌真没机会抄底,06-24 02:44
亏了好多钱啊。。。。啊啊啊,06-24 02:21
比周五的剧情还恶劣些,06-24 02:44
什么时候是个头[哭][哭][哭][哭],06-24 02:44
开启下跌模式！,06-24 02:44
我就想问是怎么做到的,06-24 02:34
抄底的全活埋,06-24 02:44
取消量化取消转融通。,06-24 02:33
明天2900啊,06-24 02:44
#IPO受理、上会全部恢复，如何解读？#,06-24 02:44
这种股市普通百姓还是退出吧，玩不了的。,06-24 02:31
可怜的小散,06-24 02:44
漂亮往死里砸,06-24 02:44
"梭哈etf,不信回不去",06-24 02:27
两兄弟都会摸一下2千6的[捂脸][捂脸],06-24 02:44
明天大盘反弹到5日线,06-24 02:33
恭喜恭喜！成功挤掉了泡沫！[赞][赞][赞],06-24 02:44
尾盘继续杀，破2950,06-24 02:44
现在走的是机构，明后天走的才会是散户,06-24 02:44
就问你服不服..还有谁不服的,06-24 02:43
真是,06-24 02:43
加速,06-24 02:43
空仓休息吧,06-24 02:43
清仓再见,06-24 02:43
各位扶好了。准备自由落体了,06-24 02:43
拉茅台出货科技股,06-24 02:43
远远没有到底,06-24 02:43
！,06-24 02:43
这样下去怎么得了,06-24 02:43
当前脆弱的市场没有实际性强心剂一定是举步维艰！大盘继续下行破3000点是势在必行,06-24 02:43
上午指数跌1个多点的时候也没跌这么多啊……忙完打开软件，吓一跳……擦,06-24 02:43
今天进去，明天[大哭],06-24 02:31
大盘如果反过来这样涨是有关部门肯定会坐不住，半夜弄个什么叫,06-24 02:43
今天就一次减亏，打气是告诉大家别轻易割肉，冰点是个周期不是一天，小周期也是3天以,06-24 02:27
2500见,06-24 02:42
TM亏损70%了,06-24 02:28
收盘估计跌1.5%,06-24 02:42
大A利好，量化盛行，转融通通天，IPO全线开通！,06-24 02:42
发誓不炒股啦。推出股市。销户远离。今天全部亏损清仓。删除所有炒股有关的软件,06-24 02:42
2899,06-24 02:42
快停转融通吧，全部都止不住了,06-24 02:42
一无所有，清仓销户,06-24 02:42
市场表现说明一切#IPO受理、上会全部恢复，如何解读？#,06-24 02:42
7月资金面有望宽松，短端存在补张可能，如何抓住？,06-24 11:46
看这黄蓝线差距，就知道今天虽然指数跌了1%，但是小盘股咱俩大亏特亏[偷笑],06-24 02:42
微跌一个点，是为将来大涨半个点做准备,06-24 02:42
抛了还要怎么样的丨P0去吧去吧去吧去吧！,06-24 02:42
散户看K线秘诀:看似要向上，其实第二天是跌;看似要下跌，第二天却涨。为什么这样?,06-24 02:41
周K死叉，不破2600也是双底了！！[赞][赞],06-24 02:41
这轮2800能稳住就算牛了,06-24 02:41
抄底，明天博个大反弹，今天跌这么多，明天100%会反弹一波的,06-24 02:41
$上证指数(SH000001)$,06-24 02:41
就让一切随风,06-24 02:01
一大早就溃不成军，这会儿想反扑，早干嘛去了,06-24 02:01
主力没吃饭吗？才流出这么点,06-24 02:00
真惨,06-24 02:00
老乡别走，牛市来了,06-24 02:00
$上证指数(SH000001)$,06-24 02:00
销户#IPO受理、上会全部恢复，如何解读？#,06-24 02:00
某又观望》低空经济》，刚买就亏……：120分钟macd死叉期间……【粗加工李某人,06-24 02:00
两点钟，神奇的两点？,06-24 01:54
还有423只红，你们怎么不买,06-24 02:00
今天拉银行护盘，明天拉啥？护盘。,06-24 01:44
明天大盘还会继续下，最低的底线是2970点，如果顺利触碰到这个位置，下周绝对会暴,06-20 07:15
不急，个人认为还有120点杀一下。,06-24 02:00
还得是你啊2960到3170两个月才到，3170到2960只用一个月,06-24 02:00
这么低价位大盘股。我大力加仓买大盘了。马上就要大力反弹涨停这么低价位大盘股。我大,06-24 02:00
一家股票市场反应的什么？,06-24 01:59
这每天拉下50指数有毛用，拉又拉不上去，散户亏得还更厉害，拉中证2000整个大盘,06-24 01:49
这种有还用解读吗#IPO受理、上会全部恢复，如何解读？#,06-24 01:59
天天都想着那些乱七八糟的神秘资金救市，四季酒店,06-24 01:59
啥也不是#IPO受理、上会全部恢复，如何解读？#,06-24 01:59
2800肯定是要破的 韭菜们 不要急 慢慢等,06-24 01:59
指数可能不怎么跌，但个股大部分已经走的是2018年的图了。,06-24 01:59
不要慌，微跌而已。,06-24 01:59
大盘要走双底形态,06-24 01:59
#高盛发声：中国市场已现复苏信号#,06-24 01:59
整死最后一帮号称中产的,06-24 01:52
希望别破2000点,06-24 01:59
还得说大盘股蓝筹股！其他全废了废了,06-24 01:59
每天向下努力一点点，破2635没那么难,06-24 01:58
管住手。别去抄底。还没到时候。等2865,06-24 01:58
黄金坑机会难得[哈哈],06-24 01:58
这波要跌到2500,06-24 01:58
拉起来也没人跟了，割不到韭菜了,06-24 01:58
#IPO受理、上会全部恢复，如何解读？#,06-24 01:49
准备销户，没什么玩了,06-24 01:58
短暂的反弹已经结束，接下来继续向下[捂脸],06-24 01:58
涨时没它们事，跌时比英伟达还多,06-24 01:58
跑了300亿,06-24 01:58
希望在田野上,06-24 01:58
我爱你，中国！[傲][傲][傲],06-24 01:58
最惨的是割肉的又去抄底，然后又被埋了。,06-24 01:58
还不如[怒],06-24 01:58
还行吧,06-24 01:58
今天这种一砸一拉，再阴跌下来，个股被砸的惨不忍睹啊！[笑哭],06-24 01:58
有没有融资市场管理的精英了,06-24 01:58
牛市要来了[赞],06-24 01:58
世界上水最深的是大海！比大海更深的是大A！！所以，大A才真正的没有底了！！！,06-24 01:58
指数不跌，厉害,06-24 01:57
今天护盘，明天就砸盘,06-24 01:57
反正这种行情还是做期权合适，你A还没到连波动性都消失的程度。没权限的还是老老实实,06-24 01:57
千股涨停#IPO受理、上会全部恢复，如何解读？#,06-24 01:57
$上证指数(SH000001)$,06-24 01:57
加速下跌毫无止境,06-24 01:57
重复一月份行情，还能有啥，空仓一个月吧#IPO受理、上会全部恢复，如何解读？#,06-24 01:57
2950不摸摸吗,06-24 01:57
还有一百点,06-24 01:56
现外面大环境哈情况？？？还要涨？,06-24 01:56
都不给反向选项了吗#IPO受理、上会全部恢复，如何解读？#,06-24 01:56
2900此轮也守不住的,06-24 01:56
杨德龙博士：永远不卖贵州茅台！,06-24 11:06
一拉亏得更多了[哭],06-24 01:56
套中套,06-24 01:56
到底了没有,06-24 01:55
跳水喽,06-24 01:55
#IPO受理、上会全部恢复，如何解读？#,06-24 01:55
没啥说的，绝望！已经反应在盘面上了#IPO受理、上会全部恢复，如何解读？#,06-24 01:55
成交量过3000了没,06-24 01:55
2900  2900  2900,06-24 01:55
……,06-24 01:55
本周破2900,06-24 01:54
我服了指数还有2900多我的股已经跌到2600多附近了[哭][哭],06-24 11:32
人往高处走，水往低处流。,06-24 01:54
盘中拉高，尾盘跳水，有意思吗？,06-24 01:54
炸锅砸铁进场,06-24 01:54
你说你拉什么，拉了再砸，个股红，你拉一次红，砸一次绿，咋滴啦，看着三百多红。你心,06-24 01:54
煎熬,06-24 01:54
拉一点回去做量化再打下来亏的永远是散户,06-24 01:54
2865的缺口马上会补,06-24 01:54
不管未来是否还有牛市，目前白骨累累尸骨无存者不知凡几！怨气盈天者会有何动作？细思,06-24 01:54
$上证指数(SH000001)$,06-24 01:54
这走势伤害极大侮辱性极强,06-24 01:53
54万买了支付宝推荐金牌的葛兰基金上周清仓余27万,06-24 01:53
指数跌一个多点的时候也没亏这么多……反弹了一下，在回落钱没了,06-24 01:53
现在应该勇敢抄底银行股,06-24 01:44
系统性风险来袭？耐心等待下个上涨周期出现。,06-24 10:36
拉起来就是为了更好的下跌。,06-24 01:53
继续没量,06-24 01:53
已经忽悠不动了,06-24 01:53
没的救了吗？,06-24 01:52
天天跌什么鬼五千多个四千几个跌,06-24 01:52
天天板命，天天续命,06-24 01:52
有良心的人都会建议:任意位置出局都是正确的选择！！！,06-24 01:51
这种横盘，两点之后肯定踩踏！,06-24 01:51
个个翘二郎腿真的很牛[赞],06-24 01:51
看来一直要跌到银行股分红才行,06-24 01:51
击破各种幻想，专治各种妄想症。药到病除，只要赶进来，就发套。,06-24 01:51
下午跳水，跌破2900,06-24 01:51
这个行情太难了，现在能闭眼加的也只有宽基指数了，核心资产之前调整了不少，A50是,06-24 01:51
牛市别怕,06-24 01:51
我全仓买进，力挺股市，,06-24 01:51
你的不是我的零头在！,06-24 01:50
融券的，量化的，大显身手,06-24 01:50
赶快下来，我还没有上车，我还没有上车，下来下来,06-24 01:20
下跌带量，反弹无量,06-24 01:50
期盼的利好一样都没出，却雪上加霜。#IPO受理、上会全部恢复，如何解读？#,06-24 01:50
6月24号午评：普跌之下，不知道为什么，数字货币近期如此强势？,06-24 12:38
散户也做空,06-24 01:50
再不拉影响太大。,06-24 01:49
谁都不要轻易割肉砸盘，大家都难受[握手],06-24 01:49
上午大盘最低的时候。我的票跌五个点。现在指数起来了。我的票跌了八个点。[为什么],06-24 01:43
诱多完成！砸盘下跌套你没商量？,06-24 01:49
今天大盘会红,06-24 01:49
哎哟哟，你能不能像爱康连续跌停跌多算了，我都不用销户了,06-24 01:49
供应的股票过多！卖不完！,06-24 01:49
天天拉大票？如果我是救火队员，直接去各个板块买龙头，一天突击一个亿,06-24 01:49
一次又一次的相信你，你却一次又一次的伤害我,06-24 01:49
大家都撤吧，没法玩了,06-24 01:48
年年赔2万，十年下来吧赔20万J,06-24 01:44
今天不跌的票都值得长期持有,06-24 01:41
重启说明公司更需要融资解困,06-24 01:43
没实力就别来护盘,06-24 01:43
拉一下又不拉了，搁这诱多呢,06-24 01:37
成交量大了,06-24 01:48
静等神奇的2:30，助力发起总攻,06-24 01:48
回家看了看看#IPO受理、上会全部恢复，如何解读？#,06-24 01:48
gjd刚稳一下，马上轮到科技主动砸盘了,06-24 01:48
你真行,06-24 01:43
兴业科技为啥没人买,06-24 01:47
2970再买回,06-24 01:47
周线七连跌,06-24 01:47
如果做空能赚钱，才会做多,06-24 01:47
能让人恶心死,06-24 01:47
2930,06-24 01:46
十天就有九天主力在套现离场，现在北向资金也在抽逃资金，很快就会回到四年前的270,06-24 01:39
还是空头厉害了,06-24 01:46
#IPO受理、上会全部恢复，如何解读？#,06-24 01:46
不卖就割不了我的韭菜。,06-24 01:40
又是拉银行的一天。,06-24 01:46
#小盘股大跌！股友：我终于止亏了#每每每次大跌的都是小盘股！！！！真是就无可救,06-24 01:46
没到2440永不建仓,06-24 01:46
股市有风险，量化吃人间。,06-24 01:46
"为什么在这个时候要重启IPO,就那么急吗？",06-24 01:38
就不能不拉银行石油吗,06-24 01:46
很想看大盘跌停[大笑][大笑][大笑],06-24 01:41
今天上午市场走势较弱，但物极必反否极泰来，跌的多了必然反弹，涨的多了必然回调一样,06-24 01:35
一二三，开始跳[赞][赞],06-24 01:46
这个能涨？想啥子,06-24 01:45
老乡，不要走,06-24 01:39
跌多一些就安全了，上涨了积累风险,06-24 01:45
今天抄底,06-24 01:45
图了啥，有那功夫看蚂蚁搬家，也比抄股有意义,06-24 01:45
抄底,06-24 01:45
唉呀！真搞不得啊！又套住了啊！到底是不是底啊！,06-24 01:45
乛帮幻想的韭菜兄弟们在这里挣扎，细想一下内资疯狂出逃是有原因的，真正的恐怖式下跌,06-24 01:45
新一轮暴跌开始了#IPO受理、上会全部恢复，如何解读？#,06-24 01:45
跌得好，就该跌，这个时候开启ipo不跌不正常,06-24 01:45
喝多了酒看大盘全是红的。～～,06-24 01:44
誓与大A共存,06-24 01:44
哌哌叫,06-24 01:44
A古：就一句话，等待反转！A古，完全不像话，又是暴跌古灾走势！但是猫妹明确观点，,06-24 11:56
今天散户割肉了，能超跌反弹吗，能重回3000点吗？,06-24 01:21
短期是没好了，割肉清仓了#IPO受理、上会全部恢复，如何解读？#,06-24 01:26
A古：拐点，已现！1、“科八条”后连续两单科创公司并购案出炉！“科创板八条”发布,06-24 08:14
#英伟达高位调整，科技股面临抛压？##鸿博股份是谁的？尤氏家族套现离场##A股跌,06-24 11:15
无论如何今天都得跌20点左右,06-24 01:25
可别拉了，越这时候拉，下午跌的越惨,06-24 01:25
牛来了，赶紧抄底一百万,06-24 01:25
今天大盘蹦盘跌停一步到位，个股全线跌停，那才是最好的,06-24 01:25
管住手，马上继续,06-24 01:25
这可能是最后跑路机会了！银行和茅台喘口气，大盘比跳伞还快！,06-24 01:24
喋喋不休#IPO受理、上会全部恢复，如何解读？#,06-24 01:24
都拉了什么,06-24 01:24
仍然有4700多家待涨,06-24 01:19
【百万基金操作】大动作，今日全面加仓，大幅发车红利方向,06-24 01:15
拼了命的拉权重，拉老白马[哈欠],06-24 01:20
不会跌四千多家，指数倒还红了吧[滴汗][滴汗][滴汗],06-24 01:08
护盘了，拉中特估了,06-24 01:24
全网都在说下午深V，主力傻吗，,06-24 01:24
还在筑底,06-24 01:24
机会来了！全是低点,06-24 10:38
茅指数护盘，不然都蹦了，看来还会跌,06-24 01:23
还有钱么兄弟们？#IPO受理、上会全部恢复，如何解读？#,06-24 01:23
今天上午上证流出100亿厉害了我的股。,06-24 01:23
2600,06-24 01:23
拉先调整的中字头，有色金属和金融股才是最优解，半导体芯片顺势回踩回20日线，这样,06-24 01:22
少数人能赚只能干大盘股,06-24 01:22
毫无支撑,06-20 03:42
拉的沪深300，不要去接，等,06-24 01:22
求求你们了好心人,06-24 01:22
【机构关注水利板块！】,06-21 06:43
七亏二平一赚（其中还分小赚和大赚）,06-24 01:22
反包？,06-24 01:22
炒股廿几年,06-24 11:57
这扭扭捏捏的不敢跌又不敢涨，这是要洗走多少小散才知足,06-24 01:21
这市场已没有参预的意义了，再不退出散户的钱要被洗光啦！[想一下]#IPO受理、上,06-24 01:21
为什么多数落后大盘远远的,06-24 01:21
6.24早评|停不下来！周末突传利空！本周A股怎么走？,06-24 02:07
大盘翻红，5000只下跌,06-24 01:21
证券,06-24 01:21
请大家写出股民的心声,06-24 01:05
$上证指数(SH000001)$,06-24 01:20
利好融券做空，量化杀猪#IPO受理、上会全部恢复，如何解读？#,06-24 11:18
好主力真听话，破2970有个股加仓的，现在拉升2988，兑现预判走势！个股有差加,06-24 01:13
三大交易所IPO受理全部恢复北交所于21日晚间受理了3家企业的IPO申请，这是北,06-24 07:57
虽然今天看起来很多股票跌了，但是我的自选还是大部分涨的。,06-24 01:20
拉茅台，万一拉不动了咋办？,06-24 01:19
太牛逼了倒在黎明前我割肉在最低点[哭][哭][哭][哭],06-24 01:19
只能说别抱幻想了我只是普通人我的钱也不是大风刮来回本遥遥无期,06-24 01:19
现在是牛市的最后阶段，我们称为牛奋。,06-24 01:19
诱多又开始了,06-24 01:19
国内资本没有一点担当,06-24 01:19
真的好快,06-24 01:19
个股都在水下艰难爬升，就怕爬到一半就突然歇菜了。。。,06-24 01:19
2860点处等你。,06-24 01:19
加油！中国加油加油，,06-24 01:18
神奇的指数,06-24 01:18
#IPO受理、上会全部恢复，如何解读？#,06-24 01:18
右手一伸亏损五万求求你不要再伸手了,06-24 01:18
兄弟们。把手上的银行股。证券股，全部砸出来。把指数在砸下来。,06-24 01:18
大盘反包不了后市继续跌,06-24 01:01
高潮次日不追高，何况还是周一，重复无数次的历史了，所以周五特地发帖如果周五开板可,06-24 10:07
有本事把做空放开，散户一起参与，,06-24 01:18
今天全部清仓祝还在玩的股友回本翻倍,06-24 01:03
太幽默了,06-24 01:17
硬拉权重股护指数，其他个股跌成什么样了[偷笑],06-24 01:17
流出300亿跌一个多点，流入3亿涨回去0.7，难怪越来越亏,06-24 01:17
基金做空完毕，开宝马进场抄底了，不想段胳膊段腿的赶紧进来，,06-24 01:17
今天不跌也过几天跌 没有希望 别最近抱幻想,06-24 01:17
破罐子破摔#IPO受理、上会全部恢复，如何解读？#,06-24 01:17
拉消费拉白酒拉房地产拉超跌拉超跌类热门不会么,06-24 01:17
茅指数拉升才能稳住了大A的下跌，是触底反弹，还是下跌中继？还得看明天的大金融概念,06-24 01:17
国家对已经进场，同志们大胆的干,06-24 01:17
明天还要跌的，不过2950差不多了,06-24 01:17
已经杀疯了，正业绩的股票已经杀到1元一下了,06-24 01:16
明天继续跌不看了,06-24 01:16
下去吧别硬撑了,06-24 01:16
弄不好要回踩2800附近,06-24 12:47
A股中，体现中小市值股票尤其是几千只中小微市值股票价格水平的中证2000指数，今,06-21 02:11
别急，在拉茅台了,06-24 01:08
没什么好说的，投资者利益不值一提，有什么毛病他们更是不屑一顾，觉得弹指便可摆平#,06-24 12:58
个股[微笑],06-24 01:08
拉地产，聚人气，起大盘,06-24 01:08
又有资金在往脸上贴金了,06-24 01:03
清仓说了多少遍了，就是没人听，接下来根本就不会有行情,06-24 01:08
该跑的要跑，不该买的也要按住手别买，弱势行情下，必须谨慎，每一笔操作都要稳字当头,06-20 03:56
聪明人已经销户了[坏笑],06-24 12:53
我就只想回个本,06-24 01:08
大盘到底了吗？－《6月24日午盘评测》,06-24 12:02
外资看多，疯狂买入，然后卖出做空,06-24 01:08
骗人的下影线,06-24 01:08
这几年下来，耗尽心血，最终只是玩个寂寞[大笑][大笑][大笑][大笑][大笑][,06-24 12:54
又拉着指数了,06-24 01:07
400家上涨还选择拉白酒，明天大盘继续跌,06-24 01:07
散户不交易，成交量少很多。量化割好公司持友者股票，成交量也会少很多，转融通出借好,06-24 11:07
---从时间周期综合来看：下周会出现重要的变盘点概率；下周继续破位2985那么在,06-24 08:24
收大阳线,06-24 01:06
最后满仓抄底时刻，抢筹码[买入][买入][买入],06-24 01:06
反正指数不能跌个股随意,06-24 01:06
不要怕，十几年的三千点震荡，高抛低吸就是干。,06-24 01:06
坚心今天收红盘,06-24 01:06
每天都这样，谁受得了,06-24 01:06
拉超跌股不会么？,06-24 01:06
我TM竟然空仓了,06-24 01:06
量化要回来了，不然没有成交量，也就没有接盘侠[偷笑],06-24 01:05
4800个绿盘了。。。还不错没到5000,06-24 10:41
既然利空言论发不出就拼命喊利好。大A股迎来超级抄底的好时机！千载难逢！它的整体估,06-24 01:05
在恢复IPO受理之前，上市审核已率先恢复。南开大学金融发展研究院院长田利辉对第一,06-24 11:07
认为自己可以踏准节奏，能做好股价涨跌的波段，其实想象与实际操作结果总是不一样的，,06-23 06:08
周线六连阴！看了一下还是2018年有过七连阴,06-24 01:05
以前股市：吸筹，洗盘，拉升，出货，现在股市：上市，出货，暴雷，退市,06-24 01:04
多少人把钱牢牢存入股市了？,06-24 01:04
抽筋#IPO受理、上会全部恢复，如何解读？#,06-24 01:04
今天跌破2900,06-24 01:04
敢抄底？,06-24 01:04
量化基金能提高流动性在哪里，看到的量化通过转融通做空,06-24 01:04
